datum,Date,Time,M01AB,M01AE,N02BA,N02BE,N05B,N05C,R03,R06,Year,Month,Hour,Weekday Name
1/2/2014 8:00,2014-01-02,08:00,0,0.67,0.4,2,0,0,0,1,2014,1,8,Thursday
1/2/2014 9:00,2014-01-02,09:00,0,0,1,0,2,0,0,0,2014,1,9,Thursday
1/2/2014 10:00,2014-01-02,10:00,0,0,0,3,2,0,0,0,2014,1,10,Thursday
1/2/2014 11:00,2014-01-02,11:00,0,0,0,2,1,0,0,0,2014,1,11,Thursday
1/2/2014 12:00,2014-01-02,12:00,0,2,0,5,2,0,0,0,2014,1,12,Thursday
1/2/2014 13:00,2014-01-02,13:00,0,1,2,20.4,0,0,0,1,2014,1,13,Thursday
1/2/2014 14:00,2014-01-02,14:00,0,0,0,0,0,0,0,0,2014,1,14,Thursday
1/2/2014 15:00,2014-01-02,15:00,0,0,0,0,0,0,0,0,2014,1,15,Thursday
1/2/2014 16:00,2014-01-02,16:00,0,0,0,0,0,0,0,0,2014,1,16,Thursday
1/2/2014 17:00,2014-01-02,17:00,0,0,0,0,0,0,0,0,2014,1,17,Thursday
1/2/2014 18:00,2014-01-02,18:00,0,0,0,0,0,0,0,0,2014,1,18,Thursday
1/2/2014 19:00,2014-01-02,19:00,0,0,0,0,0,0,0,0,2014,1,19,Thursday
1/2/2014 20:00,2014-01-02,20:00,0,0,0,0,0,0,0,0,2014,1,20,Thursday
1/2/2014 21:00,2014-01-02,21:00,0,0,0,0,0,0,0,0,2014,1,21,Thursday
1/2/2014 22:00,2014-01-02,22:00,0,0,0,0,0,0,0,0,2014,1,22,Thursday
1/2/2014 23:00,2014-01-02,23:00,0,0,0,0,0,0,0,0,2014,1,23,Thursday
1/3/2014 0:00,2014-01-03,00:00,0,0,0,0,0,0,0,0,2014,1,0,Friday
1/3/2014 1:00,2014-01-03,01:00,0,0,0,0,0,0,0,0,2014,1,1,Friday
1/3/2014 2:00,2014-01-03,02:00,0,0,0,0,0,0,0,0,2014,1,2,Friday
1/3/2014 3:00,2014-01-03,03:00,0,0,0,0,0,0,0,0,2014,1,3,Friday
1/3/2014 4:00,2014-01-03,04:00,0,0,0,0,0,0,0,0,2014,1,4,Friday
1/3/2014 5:00,2014-01-03,05:00,0,0,0,0,0,0,0,0,2014,1,5,Friday
1/3/2014 6:00,2014-01-03,06:00,0,0,0,0,0,0,0,0,2014,1,6,Friday
1/3/2014 7:00,2014-01-03,07:00,0,0,0,0,1,0,0,0,2014,1,7,Friday
1/3/2014 8:00,2014-01-03,08:00,0,0,0,0.6,0,0,0,0,2014,1,8,Friday
1/3/2014 9:00,2014-01-03,09:00,0,0,1,1,0,0,0,0,2014,1,9,Friday
1/3/2014 10:00,2014-01-03,10:00,1,2,0,4.1,2,0,0,0,2014,1,10,Friday
1/3/2014 11:00,2014-01-03,11:00,4,0,1,8,4,0,0,0,2014,1,11,Friday
1/3/2014 12:00,2014-01-03,12:00,0,0,0.4,10.4,4,0,10,1,2014,1,12,Friday
1/3/2014 13:00,2014-01-03,13:00,1,1,0,3,2,0,0,0,2014,1,13,Friday
1/3/2014 14:00,2014-01-03,14:00,0,0,0,3,0,0,1,0,2014,1,14,Friday
1/3/2014 15:00,2014-01-03,15:00,1,0,0,3,0,0,6,2,2014,1,15,Friday
1/3/2014 16:00,2014-01-03,16:00,0,1,0,4.2,0,0,2,0,2014,1,16,Friday
1/3/2014 17:00,2014-01-03,17:00,1,0,1,4,1,0,0,1,2014,1,17,Friday
1/3/2014 18:00,2014-01-03,18:00,0,0,1,0.3,2,0,0,0,2014,1,18,Friday
1/3/2014 19:00,2014-01-03,19:00,0,0,0,1,0,0,1,0,2014,1,19,Friday
1/3/2014 20:00,2014-01-03,20:00,0,0,0,8,0,0,0,0,2014,1,20,Friday
1/3/2014 21:00,2014-01-03,21:00,0,0,0,0,0,0,0,0,2014,1,21,Friday
1/3/2014 22:00,2014-01-03,22:00,0,0,0,0,0,0,0,0,2014,1,22,Friday
1/3/2014 23:00,2014-01-03,23:00,0,0,0,0,0,0,0,0,2014,1,23,Friday
1/4/2014 0:00,2014-01-04,00:00,0,0,0,0,0,0,0,0,2014,1,0,Saturday
1/4/2014 1:00,2014-01-04,01:00,0,0,0,0,0,0,0,0,2014,1,1,Saturday
1/4/2014 2:00,2014-01-04,02:00,0,0,0,0,0,0,0,0,2014,1,2,Saturday
1/4/2014 3:00,2014-01-04,03:00,0,0,0,0,0,0,0,0,2014,1,3,Saturday
1/4/2014 4:00,2014-01-04,04:00,0,0,0,0,0,0,0,0,2014,1,4,Saturday
1/4/2014 5:00,2014-01-04,05:00,0,0,0,0,0,0,0,0,2014,1,5,Saturday
1/4/2014 6:00,2014-01-04,06:00,0,0,0,0,0,0,0,0,2014,1,6,Saturday
1/4/2014 7:00,2014-01-04,07:00,0,0,0,0,0,0,0,0,2014,1,7,Saturday
1/4/2014 8:00,2014-01-04,08:00,1,0,0.2,0,0,0,0,0,2014,1,8,Saturday
1/4/2014 9:00,2014-01-04,09:00,0,0,0,9,0,0,0,0,2014,1,9,Saturday
1/4/2014 10:00,2014-01-04,10:00,0,0,1,9,3,0,5,0,2014,1,10,Saturday
1/4/2014 11:00,2014-01-04,11:00,1,0,2,5,0,0,0,0,2014,1,11,Saturday
1/4/2014 12:00,2014-01-04,12:00,0,0,0,2,0,0,0,0,2014,1,12,Saturday
1/4/2014 13:00,2014-01-04,13:00,0,0,0,3,1,0,0,0,2014,1,13,Saturday
1/4/2014 14:00,2014-01-04,14:00,0,1,0,6,2,0,0,0,2014,1,14,Saturday
1/4/2014 15:00,2014-01-04,15:00,0,0,0,1,0,0,0,0,2014,1,15,Saturday
1/4/2014 16:00,2014-01-04,16:00,0,0,0.3,6,0,0,0,0,2014,1,16,Saturday
1/4/2014 17:00,2014-01-04,17:00,0,0,0,1.25,1,0,0,0,2014,1,17,Saturday
1/4/2014 18:00,2014-01-04,18:00,0,0,0,10,0,0,0,0,2014,1,18,Saturday
1/4/2014 19:00,2014-01-04,19:00,0,0,3,9,0,0,4,1,2014,1,19,Saturday
1/4/2014 20:00,2014-01-04,20:00,0,0,0,0.6,3,0,0,0,2014,1,20,Saturday
1/4/2014 21:00,2014-01-04,21:00,0,0,0,0,0,0,0,0,2014,1,21,Saturday
1/4/2014 22:00,2014-01-04,22:00,0,0,0,0,0,0,0,0,2014,1,22,Saturday
1/4/2014 23:00,2014-01-04,23:00,0,0,0,0,0,0,0,0,2014,1,23,Saturday
1/5/2014 0:00,2014-01-05,00:00,0,0,0,0,0,0,0,0,2014,1,0,Sunday
1/5/2014 1:00,2014-01-05,01:00,0,0,0,0,0,0,0,0,2014,1,1,Sunday
1/5/2014 2:00,2014-01-05,02:00,0,0,0,0,0,0,0,0,2014,1,2,Sunday
1/5/2014 3:00,2014-01-05,03:00,0,0,0,0,0,0,0,0,2014,1,3,Sunday
1/5/2014 4:00,2014-01-05,04:00,0,0,0,0,0,0,0,0,2014,1,4,Sunday
1/5/2014 5:00,2014-01-05,05:00,0,0,0,0,0,0,0,0,2014,1,5,Sunday
1/5/2014 6:00,2014-01-05,06:00,0,0,0,0,0,0,0,0,2014,1,6,Sunday
1/5/2014 7:00,2014-01-05,07:00,0,0,0,0,0,0,0,0,2014,1,7,Sunday
1/5/2014 8:00,2014-01-05,08:00,1,0,1,3,0,0,0,0,2014,1,8,Sunday
1/5/2014 9:00,2014-01-05,09:00,0,0,1,5.2,2,0,0,0,2014,1,9,Sunday
1/5/2014 10:00,2014-01-05,10:00,0,0,0,4,0,0,0,0,2014,1,10,Sunday
1/5/2014 11:00,2014-01-05,11:00,0,0,0,4,1,0,3,0,2014,1,11,Sunday
1/5/2014 12:00,2014-01-05,12:00,1,2,2,12.9,3,0,0,0,2014,1,12,Sunday
1/5/2014 13:00,2014-01-05,13:00,2,1,3,12,2,0,0,0,2014,1,13,Sunday
1/5/2014 14:00,2014-01-05,14:00,0,0,0,0,0,0,0,0,2014,1,14,Sunday
1/5/2014 15:00,2014-01-05,15:00,0,0,0,0,0,0,0,0,2014,1,15,Sunday
1/5/2014 16:00,2014-01-05,16:00,0,0,0,0,0,0,0,0,2014,1,16,Sunday
1/5/2014 17:00,2014-01-05,17:00,0,0,0,0,0,0,0,0,2014,1,17,Sunday
1/5/2014 18:00,2014-01-05,18:00,0,0,0,0,0,0,0,0,2014,1,18,Sunday
1/5/2014 19:00,2014-01-05,19:00,0,0,0,0,0,0,0,0,2014,1,19,Sunday
1/5/2014 20:00,2014-01-05,20:00,0,0,0,0,0,0,0,0,2014,1,20,Sunday
1/5/2014 21:00,2014-01-05,21:00,0,0,0,0,0,0,0,0,2014,1,21,Sunday
1/5/2014 22:00,2014-01-05,22:00,0,0,0,0,0,0,0,0,2014,1,22,Sunday
1/5/2014 23:00,2014-01-05,23:00,0,0,0,0,0,0,0,0,2014,1,23,Sunday
1/6/2014 0:00,2014-01-06,00:00,0,0,0,0,0,0,0,0,2014,1,0,Monday
1/6/2014 1:00,2014-01-06,01:00,0,0,0,0,0,0,0,0,2014,1,1,Monday
1/6/2014 2:00,2014-01-06,02:00,0,0,0,0,0,0,0,0,2014,1,2,Monday
1/6/2014 3:00,2014-01-06,03:00,0,0,0,0,0,0,0,0,2014,1,3,Monday
1/6/2014 4:00,2014-01-06,04:00,0,0,0,0,0,0,0,0,2014,1,4,Monday
1/6/2014 5:00,2014-01-06,05:00,0,0,0,0,0,0,0,0,2014,1,5,Monday
1/6/2014 6:00,2014-01-06,06:00,0,0,0,0,0,0,0,0,2014,1,6,Monday
1/6/2014 7:00,2014-01-06,07:00,0,0,0,0,0,0,0,0,2014,1,7,Monday
1/6/2014 8:00,2014-01-06,08:00,0,0,0,1.4,1,0,0,0,2014,1,8,Monday
1/6/2014 9:00,2014-01-06,09:00,0,0,2,1,2,0,0,1,2014,1,9,Monday
1/6/2014 10:00,2014-01-06,10:00,0,0,1,0.3,0,0,3,0,2014,1,10,Monday
1/6/2014 11:00,2014-01-06,11:00,0,0,1,3,4,0,0,0,2014,1,11,Monday
1/6/2014 12:00,2014-01-06,12:00,1,0,0,3,2,0,3,0,2014,1,12,Monday
1/6/2014 13:00,2014-01-06,13:00,1,0,0,8,1,2,0,1,2014,1,13,Monday
1/6/2014 14:00,2014-01-06,14:00,2,1,0,0,2,0,0,0,2014,1,14,Monday
1/6/2014 15:00,2014-01-06,15:00,1,0,0,3,3,0,0,0,2014,1,15,Monday
1/6/2014 16:00,2014-01-06,16:00,0,0,0.5,0,0,0,0,0,2014,1,16,Monday
1/6/2014 17:00,2014-01-06,17:00,0,0,0,2,1,0,0,0,2014,1,17,Monday
1/6/2014 18:00,2014-01-06,18:00,0,0,0,0,0,0,0,0,2014,1,18,Monday
1/6/2014 19:00,2014-01-06,19:00,0,0,0,0,0,0,0,0,2014,1,19,Monday
1/6/2014 20:00,2014-01-06,20:00,0,0,0,0,0,0,0,0,2014,1,20,Monday
1/6/2014 21:00,2014-01-06,21:00,0,0,0,0,0,0,0,0,2014,1,21,Monday
1/6/2014 22:00,2014-01-06,22:00,0,0,0,0,0,0,0,0,2014,1,22,Monday
1/6/2014 23:00,2014-01-06,23:00,0,0,0,0,0,0,0,0,2014,1,23,Monday
1/7/2014 0:00,2014-01-07,00:00,0,0,0,0,0,0,0,0,2014,1,0,Tuesday
1/7/2014 1:00,2014-01-07,01:00,0,0,0,0,0,0,0,0,2014,1,1,Tuesday
1/7/2014 2:00,2014-01-07,02:00,0,0,0,0,0,0,0,0,2014,1,2,Tuesday
1/7/2014 3:00,2014-01-07,03:00,0,0,0,0,0,0,0,0,2014,1,3,Tuesday
1/7/2014 4:00,2014-01-07,04:00,0,0,0,0,0,0,0,0,2014,1,4,Tuesday
1/7/2014 5:00,2014-01-07,05:00,0,0,0,0,0,0,0,0,2014,1,5,Tuesday
1/7/2014 6:00,2014-01-07,06:00,0,0,0,0,0,0,0,0,2014,1,6,Tuesday
1/7/2014 7:00,2014-01-07,07:00,0,0,0,0,0,0,0,0,2014,1,7,Tuesday
1/7/2014 8:00,2014-01-07,08:00,0,0,0,0,0,0,0,0,2014,1,8,Tuesday
1/7/2014 9:00,2014-01-07,09:00,0,0,0,0,0,0,0,0,2014,1,9,Tuesday
1/7/2014 10:00,2014-01-07,10:00,0,0,0,0,0,0,0,0,2014,1,10,Tuesday
1/7/2014 11:00,2014-01-07,11:00,0,0,0,0,0,0,0,0,2014,1,11,Tuesday
1/7/2014 12:00,2014-01-07,12:00,0,0,0,0,0,0,0,0,2014,1,12,Tuesday
1/7/2014 13:00,2014-01-07,13:00,0,0,0,0,0,0,0,0,2014,1,13,Tuesday
1/7/2014 14:00,2014-01-07,14:00,0,0,0,0,0,0,0,0,2014,1,14,Tuesday
1/7/2014 15:00,2014-01-07,15:00,0,0,0,0,0,0,0,0,2014,1,15,Tuesday
1/7/2014 16:00,2014-01-07,16:00,0,0,0,0,0,0,0,0,2014,1,16,Tuesday
1/7/2014 17:00,2014-01-07,17:00,0,0,0,0,0,0,0,0,2014,1,17,Tuesday
1/7/2014 18:00,2014-01-07,18:00,0,0,0,0,0,0,0,0,2014,1,18,Tuesday
1/7/2014 19:00,2014-01-07,19:00,0,0,0,0,0,0,0,0,2014,1,19,Tuesday
1/7/2014 20:00,2014-01-07,20:00,0,0,0,0,0,0,0,0,2014,1,20,Tuesday
1/7/2014 21:00,2014-01-07,21:00,0,0,0,0,0,0,0,0,2014,1,21,Tuesday
1/7/2014 22:00,2014-01-07,22:00,0,0,0,0,0,0,0,0,2014,1,22,Tuesday
1/7/2014 23:00,2014-01-07,23:00,0,0,0,0,0,0,0,0,2014,1,23,Tuesday
1/8/2014 0:00,2014-01-08,00:00,0,0,0,0,0,0,0,0,2014,1,0,Wednesday
1/8/2014 1:00,2014-01-08,01:00,0,0,0,0,0,0,0,0,2014,1,1,Wednesday
1/8/2014 2:00,2014-01-08,02:00,0,0,0,0,0,0,0,0,2014,1,2,Wednesday
1/8/2014 3:00,2014-01-08,03:00,0,0,0,0,0,0,0,0,2014,1,3,Wednesday
1/8/2014 4:00,2014-01-08,04:00,0,0,0,0,0,0,0,0,2014,1,4,Wednesday
1/8/2014 5:00,2014-01-08,05:00,0,0,0,0,0,0,0,0,2014,1,5,Wednesday
1/8/2014 6:00,2014-01-08,06:00,0,0,0,0,0,0,0,0,2014,1,6,Wednesday
1/8/2014 7:00,2014-01-08,07:00,0,0,0,0,0,0,0,0,2014,1,7,Wednesday
1/8/2014 8:00,2014-01-08,08:00,1,0,0,1,2,0,2,0,2014,1,8,Wednesday
1/8/2014 9:00,2014-01-08,09:00,0,0,2,1,3,0,0,0,2014,1,9,Wednesday
1/8/2014 10:00,2014-01-08,10:00,0,0,2,0,2,0,0,0,2014,1,10,Wednesday
1/8/2014 11:00,2014-01-08,11:00,1,1,0,0,2,0,0,0,2014,1,11,Wednesday
1/8/2014 12:00,2014-01-08,12:00,0,0,1,2,2,0,0,0,2014,1,12,Wednesday
1/8/2014 13:00,2014-01-08,13:00,0,1,2,2,0,0,5,0,2014,1,13,Wednesday
1/8/2014 14:00,2014-01-08,14:00,0.33,0,0,10.2,2,0,0,0,2014,1,14,Wednesday
1/8/2014 15:00,2014-01-08,15:00,1,0,0,2.4,1,1,0,0,2014,1,15,Wednesday
1/8/2014 16:00,2014-01-08,16:00,1,0,1,0,0,0,0,0,2014,1,16,Wednesday
1/8/2014 17:00,2014-01-08,17:00,0,0,0,0.8,0,0,0,0,2014,1,17,Wednesday
1/8/2014 18:00,2014-01-08,18:00,1,1,1,6,3,0,0,0,2014,1,18,Wednesday
1/8/2014 19:00,2014-01-08,19:00,0,0,1.5,0,2,0,0,0,2014,1,19,Wednesday
1/8/2014 20:00,2014-01-08,20:00,0,0,0,1,0,0,1,0,2014,1,20,Wednesday
1/8/2014 21:00,2014-01-08,21:00,0,0,0,0,0,0,2,0,2014,1,21,Wednesday
1/8/2014 22:00,2014-01-08,22:00,0,0,0,0,0,0,0,0,2014,1,22,Wednesday
1/8/2014 23:00,2014-01-08,23:00,0,0,0,0,0,0,0,0,2014,1,23,Wednesday
1/9/2014 0:00,2014-01-09,00:00,0,0,0,0,0,0,0,0,2014,1,0,Thursday
1/9/2014 1:00,2014-01-09,01:00,0,0,0,0,0,0,0,0,2014,1,1,Thursday
1/9/2014 2:00,2014-01-09,02:00,0,0,0,0,0,0,0,0,2014,1,2,Thursday
1/9/2014 3:00,2014-01-09,03:00,0,0,0,0,0,0,0,0,2014,1,3,Thursday
1/9/2014 4:00,2014-01-09,04:00,0,0,0,0,0,0,0,0,2014,1,4,Thursday
1/9/2014 5:00,2014-01-09,05:00,0,0,0,0,0,0,0,0,2014,1,5,Thursday
1/9/2014 6:00,2014-01-09,06:00,0,0,0,0,0,0,0,0,2014,1,6,Thursday
1/9/2014 7:00,2014-01-09,07:00,0,0,0,0,1,0,0,0,2014,1,7,Thursday
1/9/2014 8:00,2014-01-09,08:00,1,0,0,0,0,0,0,0,2014,1,8,Thursday
1/9/2014 9:00,2014-01-09,09:00,0,0.34,0,5,1,0,0,0,2014,1,9,Thursday
1/9/2014 10:00,2014-01-09,10:00,0,0.34,0,0,0,0,0,1,2014,1,10,Thursday
1/9/2014 11:00,2014-01-09,11:00,1,1,0,5,1,0,0,0,2014,1,11,Thursday
1/9/2014 12:00,2014-01-09,12:00,0,0,1,1,2,0,0,0,2014,1,12,Thursday
1/9/2014 13:00,2014-01-09,13:00,1,0,2,0,3,0,1,1,2014,1,13,Thursday
1/9/2014 14:00,2014-01-09,14:00,1,0,1,1,2,0,0,0,2014,1,14,Thursday
1/9/2014 15:00,2014-01-09,15:00,0,0,2,1,3,0,0,0,2014,1,15,Thursday
1/9/2014 16:00,2014-01-09,16:00,2,0,0,1,2,0,0,0,2014,1,16,Thursday
1/9/2014 17:00,2014-01-09,17:00,0,0,1,2,1,0,0,0,2014,1,17,Thursday
1/9/2014 18:00,2014-01-09,18:00,1,0,1,0,0,0,0,0,2014,1,18,Thursday
1/9/2014 19:00,2014-01-09,19:00,0,0,0,6,0,0,2,0,2014,1,19,Thursday
1/9/2014 20:00,2014-01-09,20:00,0,0,0,3,0,0,0,0,2014,1,20,Thursday
1/9/2014 21:00,2014-01-09,21:00,0,0,0,0,0,0,0,0,2014,1,21,Thursday
1/9/2014 22:00,2014-01-09,22:00,0,0,0,0,0,0,0,0,2014,1,22,Thursday
1/9/2014 23:00,2014-01-09,23:00,0,0,0,0,0,0,0,0,2014,1,23,Thursday
1/10/2014 0:00,2014-01-10,00:00,0,0,0,0,0,0,0,0,2014,1,0,Friday
1/10/2014 1:00,2014-01-10,01:00,0,0,0,0,0,0,0,0,2014,1,1,Friday
1/10/2014 2:00,2014-01-10,02:00,0,0,0,0,0,0,0,0,2014,1,2,Friday
1/10/2014 3:00,2014-01-10,03:00,0,0,0,0,0,0,0,0,2014,1,3,Friday
1/10/2014 4:00,2014-01-10,04:00,0,0,0,0,0,0,0,0,2014,1,4,Friday
1/10/2014 5:00,2014-01-10,05:00,0,0,0,0,0,0,0,0,2014,1,5,Friday
1/10/2014 6:00,2014-01-10,06:00,0,0,0,0,0,0,0,0,2014,1,6,Friday
1/10/2014 7:00,2014-01-10,07:00,0,0,0,0,0,0,0,0,2014,1,7,Friday
1/10/2014 8:00,2014-01-10,08:00,0,0,0,0,4,0,0,0,2014,1,8,Friday
1/10/2014 9:00,2014-01-10,09:00,1,0,1,0,3,0,0,0,2014,1,9,Friday
1/10/2014 10:00,2014-01-10,10:00,1,0,0,0,1,0,0,1,2014,1,10,Friday
1/10/2014 11:00,2014-01-10,11:00,0,0,0,0,2,1,0,0,2014,1,11,Friday
1/10/2014 12:00,2014-01-10,12:00,0,0,0,10.3,1,1,0,0,2014,1,12,Friday
1/10/2014 13:00,2014-01-10,13:00,2,0,0,12,2,0,0,1,2014,1,13,Friday
1/10/2014 14:00,2014-01-10,14:00,0,0,0,10,0,0,0,0,2014,1,14,Friday
1/10/2014 15:00,2014-01-10,15:00,0,1,0,1,1,0,0,0,2014,1,15,Friday
1/10/2014 16:00,2014-01-10,16:00,0,0,0,0,0,0,0,0,2014,1,16,Friday
1/10/2014 17:00,2014-01-10,17:00,0,0,0,12,1,0,0,0,2014,1,17,Friday
1/10/2014 18:00,2014-01-10,18:00,1,1,0,1,0,0,0,0,2014,1,18,Friday
1/10/2014 19:00,2014-01-10,19:00,0,0,0,2,0,0,0,0,2014,1,19,Friday
1/10/2014 20:00,2014-01-10,20:00,0,0,1,5,0,0,0,0,2014,1,20,Friday
1/10/2014 21:00,2014-01-10,21:00,0,0,0,0,0,0,0,0,2014,1,21,Friday
1/10/2014 22:00,2014-01-10,22:00,0,0,0,0,0,0,0,0,2014,1,22,Friday
1/10/2014 23:00,2014-01-10,23:00,0,0,0,0,0,0,0,0,2014,1,23,Friday
1/11/2014 0:00,2014-01-11,00:00,0,0,0,0,0,0,0,0,2014,1,0,Saturday
1/11/2014 1:00,2014-01-11,01:00,0,0,0,0,0,0,0,0,2014,1,1,Saturday
1/11/2014 2:00,2014-01-11,02:00,0,0,0,0,0,0,0,0,2014,1,2,Saturday
1/11/2014 3:00,2014-01-11,03:00,0,0,0,0,0,0,0,0,2014,1,3,Saturday
1/11/2014 4:00,2014-01-11,04:00,0,0,0,0,0,0,0,0,2014,1,4,Saturday
1/11/2014 5:00,2014-01-11,05:00,0,0,0,0,0,0,0,0,2014,1,5,Saturday
1/11/2014 6:00,2014-01-11,06:00,0,0,0,0,0,0,0,0,2014,1,6,Saturday
1/11/2014 7:00,2014-01-11,07:00,0,0,0,0.3,0,0,0,0,2014,1,7,Saturday
1/11/2014 8:00,2014-01-11,08:00,0,1,0,9,1,0,0,0,2014,1,8,Saturday
1/11/2014 9:00,2014-01-11,09:00,0,0,1,2,0,0,0,0,2014,1,9,Saturday
1/11/2014 10:00,2014-01-11,10:00,0,0,2,0,1,0,0,0,2014,1,10,Saturday
1/11/2014 11:00,2014-01-11,11:00,0,0,0,2,1,0,0,0.2,2014,1,11,Saturday
1/11/2014 12:00,2014-01-11,12:00,1,0,1,6,1,0,0,0,2014,1,12,Saturday
1/11/2014 13:00,2014-01-11,13:00,1,0,0,2,1,0,0,0,2014,1,13,Saturday
1/11/2014 14:00,2014-01-11,14:00,0,1,0,2,2,0,0,0,2014,1,14,Saturday
1/11/2014 15:00,2014-01-11,15:00,1,1,0,0,3,0,0,0,2014,1,15,Saturday
1/11/2014 16:00,2014-01-11,16:00,1,0,2,3,3,0,0,0,2014,1,16,Saturday
1/11/2014 17:00,2014-01-11,17:00,0,1,1,4,0,0,0,0,2014,1,17,Saturday
1/11/2014 18:00,2014-01-11,18:00,0,0.34,2.4,1,1,0,0,0,2014,1,18,Saturday
1/11/2014 19:00,2014-01-11,19:00,1,0,0,16,0,0,0,0,2014,1,19,Saturday
1/11/2014 20:00,2014-01-11,20:00,0,0,1,5,0,0,1,0,2014,1,20,Saturday
1/11/2014 21:00,2014-01-11,21:00,0,0,0,0,0,0,0,0,2014,1,21,Saturday
1/11/2014 22:00,2014-01-11,22:00,0,0,0,0,0,0,0,0,2014,1,22,Saturday
1/11/2014 23:00,2014-01-11,23:00,0,0,0,0,0,0,0,0,2014,1,23,Saturday
1/12/2014 0:00,2014-01-12,00:00,0,0,0,0,0,0,0,0,2014,1,0,Sunday
1/12/2014 1:00,2014-01-12,01:00,0,0,0,0,0,0,0,0,2014,1,1,Sunday
1/12/2014 2:00,2014-01-12,02:00,0,0,0,0,0,0,0,0,2014,1,2,Sunday
1/12/2014 3:00,2014-01-12,03:00,0,0,0,0,0,0,0,0,2014,1,3,Sunday
1/12/2014 4:00,2014-01-12,04:00,0,0,0,0,0,0,0,0,2014,1,4,Sunday
1/12/2014 5:00,2014-01-12,05:00,0,0,0,0,0,0,0,0,2014,1,5,Sunday
1/12/2014 6:00,2014-01-12,06:00,0,0,0,0,0,0,0,0,2014,1,6,Sunday
1/12/2014 7:00,2014-01-12,07:00,0,0,0,0,0,0,0,0,2014,1,7,Sunday
1/12/2014 8:00,2014-01-12,08:00,0,0,0,0,0,0,0,0,2014,1,8,Sunday
1/12/2014 9:00,2014-01-12,09:00,0,0,1,0,1,0,0,0,2014,1,9,Sunday
1/12/2014 10:00,2014-01-12,10:00,1,0,0,4,3,0,0,0,2014,1,10,Sunday
1/12/2014 11:00,2014-01-12,11:00,0,0,0,0,1,0,0,0,2014,1,11,Sunday
1/12/2014 12:00,2014-01-12,12:00,1,0.33,1.5,5,2,0,1,1,2014,1,12,Sunday
1/12/2014 13:00,2014-01-12,13:00,0,0.33,0,3,1,0,0,0,2014,1,13,Sunday
1/12/2014 14:00,2014-01-12,14:00,0,0,0,0,0,0,0,0,2014,1,14,Sunday
1/12/2014 15:00,2014-01-12,15:00,0,0,0,0,0,0,0,0,2014,1,15,Sunday
1/12/2014 16:00,2014-01-12,16:00,0,0,0,0,0,0,0,0,2014,1,16,Sunday
1/12/2014 17:00,2014-01-12,17:00,0,0,0,0,0,0,0,0,2014,1,17,Sunday
1/12/2014 18:00,2014-01-12,18:00,0,0,0,0,0,0,0,0,2014,1,18,Sunday
1/12/2014 19:00,2014-01-12,19:00,0,0,0,0,0,0,0,0,2014,1,19,Sunday
1/12/2014 20:00,2014-01-12,20:00,0,0,0,0,0,0,0,0,2014,1,20,Sunday
1/12/2014 21:00,2014-01-12,21:00,0,0,0,0,0,0,0,0,2014,1,21,Sunday
1/12/2014 22:00,2014-01-12,22:00,0,0,0,0,0,0,0,0,2014,1,22,Sunday
1/12/2014 23:00,2014-01-12,23:00,0,0,0,0,0,0,0,0,2014,1,23,Sunday
1/13/2014 0:00,2014-01-13,00:00,0,0,0,0,0,0,0,0,2014,1,0,Monday
1/13/2014 1:00,2014-01-13,01:00,0,0,0,0,0,0,0,0,2014,1,1,Monday
1/13/2014 2:00,2014-01-13,02:00,0,0,0,0,0,0,0,0,2014,1,2,Monday
1/13/2014 3:00,2014-01-13,03:00,0,0,0,0,0,0,0,0,2014,1,3,Monday
1/13/2014 4:00,2014-01-13,04:00,0,0,0,0,0,0,0,0,2014,1,4,Monday
1/13/2014 5:00,2014-01-13,05:00,0,0,0,0,0,0,0,0,2014,1,5,Monday
1/13/2014 6:00,2014-01-13,06:00,0,0,0,0,0,0,0,0,2014,1,6,Monday
1/13/2014 7:00,2014-01-13,07:00,0,0,0,1,0,0,0,0,2014,1,7,Monday
1/13/2014 8:00,2014-01-13,08:00,0,1,0,1,1,0,0,0,2014,1,8,Monday
1/13/2014 9:00,2014-01-13,09:00,0,2,0,5,0,0,0,0,2014,1,9,Monday
1/13/2014 10:00,2014-01-13,10:00,0,1,1,17,1,0,0,0,2014,1,10,Monday
1/13/2014 11:00,2014-01-13,11:00,1,0,0,10,1,0,0,0,2014,1,11,Monday
1/13/2014 12:00,2014-01-13,12:00,1,0,0,0,3,0,0,0,2014,1,12,Monday
1/13/2014 13:00,2014-01-13,13:00,1,0,2,1,1,0,0,0,2014,1,13,Monday
1/13/2014 14:00,2014-01-13,14:00,0,0,1.2,3,0,0,0,0,2014,1,14,Monday
1/13/2014 15:00,2014-01-13,15:00,1,0,1,1,1,0,0,0,2014,1,15,Monday
1/13/2014 16:00,2014-01-13,16:00,1,0,0,5,1,0,5,0,2014,1,16,Monday
1/13/2014 17:00,2014-01-13,17:00,0,0,1,2,0,0,0,0,2014,1,17,Monday
1/13/2014 18:00,2014-01-13,18:00,0,1,0,1,0,0,2,0,2014,1,18,Monday
1/13/2014 19:00,2014-01-13,19:00,1.34,2.34,0,2,0,0,0,0,2014,1,19,Monday
1/13/2014 20:00,2014-01-13,20:00,0,0.32,0,3,0,0,0,0,2014,1,20,Monday
1/13/2014 21:00,2014-01-13,21:00,1,0,0,0,0,0,0,1,2014,1,21,Monday
1/13/2014 22:00,2014-01-13,22:00,0,0,0,0,0,0,0,0,2014,1,22,Monday
1/13/2014 23:00,2014-01-13,23:00,0,0,0,0,0,0,0,0,2014,1,23,Monday
1/14/2014 0:00,2014-01-14,00:00,0,0,0,0,0,0,0,0,2014,1,0,Tuesday
1/14/2014 1:00,2014-01-14,01:00,0,0,0,0,0,0,0,0,2014,1,1,Tuesday
1/14/2014 2:00,2014-01-14,02:00,0,0,0,0,0,0,0,0,2014,1,2,Tuesday
1/14/2014 3:00,2014-01-14,03:00,0,0,0,0,0,0,0,0,2014,1,3,Tuesday
1/14/2014 4:00,2014-01-14,04:00,0,0,0,0,0,0,0,0,2014,1,4,Tuesday
1/14/2014 5:00,2014-01-14,05:00,0,0,0,0,0,0,0,0,2014,1,5,Tuesday
1/14/2014 6:00,2014-01-14,06:00,0,0,0,0,0,0,0,0,2014,1,6,Tuesday
1/14/2014 7:00,2014-01-14,07:00,0,0,0,0,0,0,0,0,2014,1,7,Tuesday
1/14/2014 8:00,2014-01-14,08:00,0,0,0,2,0,0,0,0,2014,1,8,Tuesday
1/14/2014 9:00,2014-01-14,09:00,2,0,0,3,1,0,0,0,2014,1,9,Tuesday
1/14/2014 10:00,2014-01-14,10:00,0,0,0,3,1,0,0,0,2014,1,10,Tuesday
1/14/2014 11:00,2014-01-14,11:00,1,0,0,9,0,0,0,0,2014,1,11,Tuesday
1/14/2014 12:00,2014-01-14,12:00,0,0.66,4,0,2,0,0,0,2014,1,12,Tuesday
1/14/2014 13:00,2014-01-14,13:00,0,0.67,3,0,2,0,0,1,2014,1,13,Tuesday
1/14/2014 14:00,2014-01-14,14:00,0,0,1,5.5,0,0,0,0,2014,1,14,Tuesday
1/14/2014 15:00,2014-01-14,15:00,1,0,1,1,0,1,0,0,2014,1,15,Tuesday
1/14/2014 16:00,2014-01-14,16:00,0,0,1,2.2,0,0,0,0,2014,1,16,Tuesday
1/14/2014 17:00,2014-01-14,17:00,0,0,0,0,0,0,0,1,2014,1,17,Tuesday
1/14/2014 18:00,2014-01-14,18:00,0,0,1,1,0,0,0,0,2014,1,18,Tuesday
1/14/2014 19:00,2014-01-14,19:00,0,0,0.3,3,0,0,0,0,2014,1,19,Tuesday
1/14/2014 20:00,2014-01-14,20:00,2,0,1,3,0,0,0,0,2014,1,20,Tuesday
1/14/2014 21:00,2014-01-14,21:00,0,0,0,1,0,0,0,0,2014,1,21,Tuesday
1/14/2014 22:00,2014-01-14,22:00,0,0,0,0,0,0,0,0,2014,1,22,Tuesday
1/14/2014 23:00,2014-01-14,23:00,0,0,0,0,0,0,0,0,2014,1,23,Tuesday
1/15/2014 0:00,2014-01-15,00:00,0,0,0,0,0,0,0,0,2014,1,0,Wednesday
1/15/2014 1:00,2014-01-15,01:00,0,0,0,0,0,0,0,0,2014,1,1,Wednesday
1/15/2014 2:00,2014-01-15,02:00,0,0,0,0,0,0,0,0,2014,1,2,Wednesday
1/15/2014 3:00,2014-01-15,03:00,0,0,0,0,0,0,0,0,2014,1,3,Wednesday
1/15/2014 4:00,2014-01-15,04:00,0,0,0,0,0,0,0,0,2014,1,4,Wednesday
1/15/2014 5:00,2014-01-15,05:00,0,0,0,0,0,0,0,0,2014,1,5,Wednesday
1/15/2014 6:00,2014-01-15,06:00,0,0,0,0,0,0,0,0,2014,1,6,Wednesday
1/15/2014 7:00,2014-01-15,07:00,0,1,0,0,0,0,0,0,2014,1,7,Wednesday
1/15/2014 8:00,2014-01-15,08:00,0,0,0,0,0,0,0,1,2014,1,8,Wednesday
1/15/2014 9:00,2014-01-15,09:00,2,0,1,1,0,0,1,0,2014,1,9,Wednesday
1/15/2014 10:00,2014-01-15,10:00,0,0,0,0,2,0,0,0,2014,1,10,Wednesday
1/15/2014 11:00,2014-01-15,11:00,0,0,1,0,0,0,0,0,2014,1,11,Wednesday
1/15/2014 12:00,2014-01-15,12:00,1,0,0,5,1,0,0,0,2014,1,12,Wednesday
1/15/2014 13:00,2014-01-15,13:00,0,0,0,3,0,0,0,1,2014,1,13,Wednesday
1/15/2014 14:00,2014-01-15,14:00,0,1,0,8,1,0,0,0,2014,1,14,Wednesday
1/15/2014 15:00,2014-01-15,15:00,0,0,0,3,0,0,2,0,2014,1,15,Wednesday
1/15/2014 16:00,2014-01-15,16:00,0,0,1,1,1,2,0,0,2014,1,16,Wednesday
1/15/2014 17:00,2014-01-15,17:00,0,0,0,4,0,0,0,0,2014,1,17,Wednesday
1/15/2014 18:00,2014-01-15,18:00,0,0,1,0,5,0,0,1,2014,1,18,Wednesday
1/15/2014 19:00,2014-01-15,19:00,0,0,1,1,1,0,0,0,2014,1,19,Wednesday
1/15/2014 20:00,2014-01-15,20:00,1,0.34,0,0.7,1,0,0,0,2014,1,20,Wednesday
1/15/2014 21:00,2014-01-15,21:00,0,0,0,0,0,0,0,0,2014,1,21,Wednesday
1/15/2014 22:00,2014-01-15,22:00,0,0,0,0,0,0,0,0,2014,1,22,Wednesday
1/15/2014 23:00,2014-01-15,23:00,0,0,0,0,0,0,0,0,2014,1,23,Wednesday
1/16/2014 0:00,2014-01-16,00:00,0,0,0,0,0,0,0,0,2014,1,0,Thursday
1/16/2014 1:00,2014-01-16,01:00,0,0,0,0,0,0,0,0,2014,1,1,Thursday
1/16/2014 2:00,2014-01-16,02:00,0,0,0,0,0,0,0,0,2014,1,2,Thursday
1/16/2014 3:00,2014-01-16,03:00,0,0,0,0,0,0,0,0,2014,1,3,Thursday
1/16/2014 4:00,2014-01-16,04:00,0,0,0,0,0,0,0,0,2014,1,4,Thursday
1/16/2014 5:00,2014-01-16,05:00,0,0,0,0,0,0,0,0,2014,1,5,Thursday
1/16/2014 6:00,2014-01-16,06:00,0,0,0,0,0,0,0,0,2014,1,6,Thursday
1/16/2014 7:00,2014-01-16,07:00,0,1,0,0,0,0,0,0,2014,1,7,Thursday
1/16/2014 8:00,2014-01-16,08:00,0,0,0,1,1,0,0,0,2014,1,8,Thursday
1/16/2014 9:00,2014-01-16,09:00,0,0,0,0,0,0,0,0,2014,1,9,Thursday
1/16/2014 10:00,2014-01-16,10:00,0,0,1,0,1,0,5,0,2014,1,10,Thursday
1/16/2014 11:00,2014-01-16,11:00,2,0,0,2,0,0,0,0,2014,1,11,Thursday
1/16/2014 12:00,2014-01-16,12:00,0,0,1,1.3,5,0,0,0,2014,1,12,Thursday
1/16/2014 13:00,2014-01-16,13:00,0,0,0,1,1,0,0,0,2014,1,13,Thursday
1/16/2014 14:00,2014-01-16,14:00,1,1,0,5,0,0,0,0,2014,1,14,Thursday
1/16/2014 15:00,2014-01-16,15:00,1,0,1.3,5,2,0,0,0,2014,1,15,Thursday
1/16/2014 16:00,2014-01-16,16:00,0,0,0,1,1,1,0,0,2014,1,16,Thursday
1/16/2014 17:00,2014-01-16,17:00,0,0,0,5,5,0,0,0,2014,1,17,Thursday
1/16/2014 18:00,2014-01-16,18:00,1,0,1,4,2,0,0,0,2014,1,18,Thursday
1/16/2014 19:00,2014-01-16,19:00,1,0,0,2,1,0,0,0,2014,1,19,Thursday
1/16/2014 20:00,2014-01-16,20:00,0,0,0,1,0,0,0,0,2014,1,20,Thursday
1/16/2014 21:00,2014-01-16,21:00,0,0,0,0,0,0,0,0,2014,1,21,Thursday
1/16/2014 22:00,2014-01-16,22:00,0,0,0,0,0,0,0,0,2014,1,22,Thursday
1/16/2014 23:00,2014-01-16,23:00,0,0,0,0,0,0,0,0,2014,1,23,Thursday
1/17/2014 0:00,2014-01-17,00:00,0,0,0,0,0,0,0,0,2014,1,0,Friday
1/17/2014 1:00,2014-01-17,01:00,0,0,0,0,0,0,0,0,2014,1,1,Friday
1/17/2014 2:00,2014-01-17,02:00,0,0,0,0,0,0,0,0,2014,1,2,Friday
1/17/2014 3:00,2014-01-17,03:00,0,0,0,0,0,0,0,0,2014,1,3,Friday
1/17/2014 4:00,2014-01-17,04:00,0,0,0,0,0,0,0,0,2014,1,4,Friday
1/17/2014 5:00,2014-01-17,05:00,0,0,0,0,0,0,0,0,2014,1,5,Friday
1/17/2014 6:00,2014-01-17,06:00,0,0,0,0,0,0,0,0,2014,1,6,Friday
1/17/2014 7:00,2014-01-17,07:00,0,0,0,0,1,0,1,0,2014,1,7,Friday
1/17/2014 8:00,2014-01-17,08:00,0,0,0,0,1,0,0,0,2014,1,8,Friday
1/17/2014 9:00,2014-01-17,09:00,1,0,0,0,0,0,0,0,2014,1,9,Friday
1/17/2014 10:00,2014-01-17,10:00,1,1,0,0,5,0,0,0,2014,1,10,Friday
1/17/2014 11:00,2014-01-17,11:00,0,0,3,1,0,0,0,1,2014,1,11,Friday
1/17/2014 12:00,2014-01-17,12:00,0,1,1,1,1,0,0,0,2014,1,12,Friday
1/17/2014 13:00,2014-01-17,13:00,0,0,1,0,1,0,0,1,2014,1,13,Friday
1/17/2014 14:00,2014-01-17,14:00,0,0,1,1,2,0,0,1,2014,1,14,Friday
1/17/2014 15:00,2014-01-17,15:00,0,0,0,1,1,0,0,0,2014,1,15,Friday
1/17/2014 16:00,2014-01-17,16:00,0,0,0,1.2,2,0,0,0,2014,1,16,Friday
1/17/2014 17:00,2014-01-17,17:00,0,1,0,2,0,0,0,0,2014,1,17,Friday
1/17/2014 18:00,2014-01-17,18:00,0,0,1,1.2,1,0,0,0,2014,1,18,Friday
1/17/2014 19:00,2014-01-17,19:00,0,0.68,0,9,0,0,5,0,2014,1,19,Friday
1/17/2014 20:00,2014-01-17,20:00,0,0,0,3,0,0,0,0,2014,1,20,Friday
1/17/2014 21:00,2014-01-17,21:00,0,0,1.3,0,0,0,0,0,2014,1,21,Friday
1/17/2014 22:00,2014-01-17,22:00,0,0,0,0,0,0,0,0,2014,1,22,Friday
1/17/2014 23:00,2014-01-17,23:00,0,0,0,0,0,0,0,0,2014,1,23,Friday
1/18/2014 0:00,2014-01-18,00:00,0,0,0,0,0,0,0,0,2014,1,0,Saturday
1/18/2014 1:00,2014-01-18,01:00,0,0,0,0,0,0,0,0,2014,1,1,Saturday
1/18/2014 2:00,2014-01-18,02:00,0,0,0,0,0,0,0,0,2014,1,2,Saturday
1/18/2014 3:00,2014-01-18,03:00,0,0,0,0,0,0,0,0,2014,1,3,Saturday
1/18/2014 4:00,2014-01-18,04:00,0,0,0,0,0,0,0,0,2014,1,4,Saturday
1/18/2014 5:00,2014-01-18,05:00,0,0,0,0,0,0,0,0,2014,1,5,Saturday
1/18/2014 6:00,2014-01-18,06:00,0,0,0,0,0,0,0,0,2014,1,6,Saturday
1/18/2014 7:00,2014-01-18,07:00,0,0,1,2,0,0,0,0,2014,1,7,Saturday
1/18/2014 8:00,2014-01-18,08:00,0,1,1,3,2,0,0,0,2014,1,8,Saturday
1/18/2014 9:00,2014-01-18,09:00,0,0,0,1,1,0,0,0,2014,1,9,Saturday
1/18/2014 10:00,2014-01-18,10:00,0,1,0,0,2,1,0,0,2014,1,10,Saturday
1/18/2014 11:00,2014-01-18,11:00,0,0,0,2,2,0,0,0,2014,1,11,Saturday
1/18/2014 12:00,2014-01-18,12:00,0,0,1,1,3,0,0,0,2014,1,12,Saturday
1/18/2014 13:00,2014-01-18,13:00,1,0,1,10,2,0,0,0,2014,1,13,Saturday
1/18/2014 14:00,2014-01-18,14:00,0,1,0.4,3,0,0,0,1,2014,1,14,Saturday
1/18/2014 15:00,2014-01-18,15:00,0,0,0.2,1.2,0,1,0,0,2014,1,15,Saturday
1/18/2014 16:00,2014-01-18,16:00,0,0,0,5,0,2,0,0,2014,1,16,Saturday
1/18/2014 17:00,2014-01-18,17:00,0,0,0,1,3,0,0,0,2014,1,17,Saturday
1/18/2014 18:00,2014-01-18,18:00,0,1,1,3,0,0,0,1,2014,1,18,Saturday
1/18/2014 19:00,2014-01-18,19:00,0,0,0,3,0,0,2,0,2014,1,19,Saturday
1/18/2014 20:00,2014-01-18,20:00,0,1.33,0.2,8,0,0,5,0,2014,1,20,Saturday
1/18/2014 21:00,2014-01-18,21:00,0,0,0,0,0,0,0,0,2014,1,21,Saturday
1/18/2014 22:00,2014-01-18,22:00,0,0,0,0,0,0,0,0,2014,1,22,Saturday
1/18/2014 23:00,2014-01-18,23:00,0,0,0,0,0,0,0,0,2014,1,23,Saturday
1/19/2014 0:00,2014-01-19,00:00,0,0,0,0,0,0,0,0,2014,1,0,Sunday
1/19/2014 1:00,2014-01-19,01:00,0,0,0,0,0,0,0,0,2014,1,1,Sunday
1/19/2014 2:00,2014-01-19,02:00,0,0,0,0,0,0,0,0,2014,1,2,Sunday
1/19/2014 3:00,2014-01-19,03:00,0,0,0,0,0,0,0,0,2014,1,3,Sunday
1/19/2014 4:00,2014-01-19,04:00,0,0,0,0,0,0,0,0,2014,1,4,Sunday
1/19/2014 5:00,2014-01-19,05:00,0,0,0,0,0,0,0,0,2014,1,5,Sunday
1/19/2014 6:00,2014-01-19,06:00,0,0,0,0,0,0,0,0,2014,1,6,Sunday
1/19/2014 7:00,2014-01-19,07:00,0,0,0,0,0,0,0,0,2014,1,7,Sunday
1/19/2014 8:00,2014-01-19,08:00,0,0,0,0,1,0,0,0,2014,1,8,Sunday
1/19/2014 9:00,2014-01-19,09:00,1,2,0,0,0,0,0,0,2014,1,9,Sunday
1/19/2014 10:00,2014-01-19,10:00,1,0,2.8,0,0,0,0,0,2014,1,10,Sunday
1/19/2014 11:00,2014-01-19,11:00,0.33,1,0.2,9.1,1,0,0,0,2014,1,11,Sunday
1/19/2014 12:00,2014-01-19,12:00,0,0,1,5,2,0,1,1,2014,1,12,Sunday
1/19/2014 13:00,2014-01-19,13:00,2,1,0,0,0,0,0,0,2014,1,13,Sunday
1/19/2014 14:00,2014-01-19,14:00,0,0,0,0,0,0,0,0,2014,1,14,Sunday
1/19/2014 15:00,2014-01-19,15:00,0,0,0,0,0,0,0,0,2014,1,15,Sunday
1/19/2014 16:00,2014-01-19,16:00,0,0,0,0,0,0,0,0,2014,1,16,Sunday
1/19/2014 17:00,2014-01-19,17:00,0,0,0,0,0,0,0,0,2014,1,17,Sunday
1/19/2014 18:00,2014-01-19,18:00,0,0,0,0,0,0,0,0,2014,1,18,Sunday
1/19/2014 19:00,2014-01-19,19:00,0,0,0,0,0,0,0,0,2014,1,19,Sunday
1/19/2014 20:00,2014-01-19,20:00,0,0,0,0,0,0,0,0,2014,1,20,Sunday
1/19/2014 21:00,2014-01-19,21:00,0,0,0,0,0,0,0,0,2014,1,21,Sunday
1/19/2014 22:00,2014-01-19,22:00,0,0,0,0,0,0,0,0,2014,1,22,Sunday
1/19/2014 23:00,2014-01-19,23:00,0,0,0,0,0,0,0,0,2014,1,23,Sunday
1/20/2014 0:00,2014-01-20,00:00,0,0,0,0,0,0,0,0,2014,1,0,Monday
1/20/2014 1:00,2014-01-20,01:00,0,0,0,0,0,0,0,0,2014,1,1,Monday
1/20/2014 2:00,2014-01-20,02:00,0,0,0,0,0,0,0,0,2014,1,2,Monday
1/20/2014 3:00,2014-01-20,03:00,0,0,0,0,0,0,0,0,2014,1,3,Monday
1/20/2014 4:00,2014-01-20,04:00,0,0,0,0,0,0,0,0,2014,1,4,Monday
1/20/2014 5:00,2014-01-20,05:00,0,0,0,0,0,0,0,0,2014,1,5,Monday
1/20/2014 6:00,2014-01-20,06:00,0,0,0,0,0,0,0,0,2014,1,6,Monday
1/20/2014 7:00,2014-01-20,07:00,0,0,0,2,0,0,0,0,2014,1,7,Monday
1/20/2014 8:00,2014-01-20,08:00,0,0,0,0,0,0,0,0,2014,1,8,Monday
1/20/2014 9:00,2014-01-20,09:00,0,0,1,1,1,0,0,0,2014,1,9,Monday
1/20/2014 10:00,2014-01-20,10:00,0,1,1,0,1,0,0,1,2014,1,10,Monday
1/20/2014 11:00,2014-01-20,11:00,2,1,0.3,0,3,0,1,0,2014,1,11,Monday
1/20/2014 12:00,2014-01-20,12:00,0,0,0,3,1,0,0,0,2014,1,12,Monday
1/20/2014 13:00,2014-01-20,13:00,0,0.34,0,0,0,0,0,1,2014,1,13,Monday
1/20/2014 14:00,2014-01-20,14:00,1,0,0,1,3,1,10,1,2014,1,14,Monday
1/20/2014 15:00,2014-01-20,15:00,1,0,0,0,3,1,0,0,2014,1,15,Monday
1/20/2014 16:00,2014-01-20,16:00,0,0,1,2.4,1,0,0,0,2014,1,16,Monday
1/20/2014 17:00,2014-01-20,17:00,0,0,0,1,0,0,1,0,2014,1,17,Monday
1/20/2014 18:00,2014-01-20,18:00,0,0,0,0.2,2,0,0,0,2014,1,18,Monday
1/20/2014 19:00,2014-01-20,19:00,2,1,0,0.3,2,0,0,0,2014,1,19,Monday
1/20/2014 20:00,2014-01-20,20:00,0,0,0,0,1,0,0,0,2014,1,20,Monday
1/20/2014 21:00,2014-01-20,21:00,0,0,0,1,0,0,0,0,2014,1,21,Monday
1/20/2014 22:00,2014-01-20,22:00,0,0,0,0,0,0,0,0,2014,1,22,Monday
1/20/2014 23:00,2014-01-20,23:00,0,0,0,0,0,0,0,0,2014,1,23,Monday
1/21/2014 0:00,2014-01-21,00:00,0,0,0,0,0,0,0,0,2014,1,0,Tuesday
1/21/2014 1:00,2014-01-21,01:00,0,0,0,0,0,0,0,0,2014,1,1,Tuesday
1/21/2014 2:00,2014-01-21,02:00,0,0,0,0,0,0,0,0,2014,1,2,Tuesday
1/21/2014 3:00,2014-01-21,03:00,0,0,0,0,0,0,0,0,2014,1,3,Tuesday
1/21/2014 4:00,2014-01-21,04:00,0,0,0,0,0,0,0,0,2014,1,4,Tuesday
1/21/2014 5:00,2014-01-21,05:00,0,0,0,0,0,0,0,0,2014,1,5,Tuesday
1/21/2014 6:00,2014-01-21,06:00,0,0,0,0,0,0,0,0,2014,1,6,Tuesday
1/21/2014 7:00,2014-01-21,07:00,0,1,0,0,0,0,0,0,2014,1,7,Tuesday
1/21/2014 8:00,2014-01-21,08:00,0,1,0,1,4,0,0,0,2014,1,8,Tuesday
1/21/2014 9:00,2014-01-21,09:00,0,0,0,3,0,0,0,0,2014,1,9,Tuesday
1/21/2014 10:00,2014-01-21,10:00,0,0.34,2,1,0,0,0,0,2014,1,10,Tuesday
1/21/2014 11:00,2014-01-21,11:00,0,0,0,7,2,0,0,0,2014,1,11,Tuesday
1/21/2014 12:00,2014-01-21,12:00,0,0,0,9,0,0,0,1,2014,1,12,Tuesday
1/21/2014 13:00,2014-01-21,13:00,1,0,0,0,2,0,0,0,2014,1,13,Tuesday
1/21/2014 14:00,2014-01-21,14:00,0,0,0,2,0,0,0,0,2014,1,14,Tuesday
1/21/2014 15:00,2014-01-21,15:00,0,0,1,0,0,0,0,0,2014,1,15,Tuesday
1/21/2014 16:00,2014-01-21,16:00,0,0,1,3,0,0,0,0,2014,1,16,Tuesday
1/21/2014 17:00,2014-01-21,17:00,0,0,0,6,1,0,0,0,2014,1,17,Tuesday
1/21/2014 18:00,2014-01-21,18:00,1,1,0,6,1,0,0,0,2014,1,18,Tuesday
1/21/2014 19:00,2014-01-21,19:00,0,0,0,0,5,0,0,0,2014,1,19,Tuesday
1/21/2014 20:00,2014-01-21,20:00,0,0,0,4,0,2,0,0,2014,1,20,Tuesday
1/21/2014 21:00,2014-01-21,21:00,0,0,0,0,0,0,0,0,2014,1,21,Tuesday
1/21/2014 22:00,2014-01-21,22:00,0,0,0,0,0,0,0,0,2014,1,22,Tuesday
1/21/2014 23:00,2014-01-21,23:00,0,0,0,0,0,0,0,0,2014,1,23,Tuesday
1/22/2014 0:00,2014-01-22,00:00,0,0,0,0,0,0,0,0,2014,1,0,Wednesday
1/22/2014 1:00,2014-01-22,01:00,0,0,0,0,0,0,0,0,2014,1,1,Wednesday
1/22/2014 2:00,2014-01-22,02:00,0,0,0,0,0,0,0,0,2014,1,2,Wednesday
1/22/2014 3:00,2014-01-22,03:00,0,0,0,0,0,0,0,0,2014,1,3,Wednesday
1/22/2014 4:00,2014-01-22,04:00,0,0,0,0,0,0,0,0,2014,1,4,Wednesday
1/22/2014 5:00,2014-01-22,05:00,0,0,0,0,0,0,0,0,2014,1,5,Wednesday
1/22/2014 6:00,2014-01-22,06:00,0,0,0,0,0,0,0,0,2014,1,6,Wednesday
1/22/2014 7:00,2014-01-22,07:00,0,0,0,1,0,0,0,0,2014,1,7,Wednesday
1/22/2014 8:00,2014-01-22,08:00,0,0,1,0,0,0,0,0,2014,1,8,Wednesday
1/22/2014 9:00,2014-01-22,09:00,0,0,1,1,0,0,0,0,2014,1,9,Wednesday
1/22/2014 10:00,2014-01-22,10:00,0,0,0.2,0,1,0,5,0,2014,1,10,Wednesday
1/22/2014 11:00,2014-01-22,11:00,2,0,0,1,0,0,0,0,2014,1,11,Wednesday
1/22/2014 12:00,2014-01-22,12:00,1,0,1.2,4.2,1,0,0,1,2014,1,12,Wednesday
1/22/2014 13:00,2014-01-22,13:00,0,0,1.3,2.5,0,0,0,0,2014,1,13,Wednesday
1/22/2014 14:00,2014-01-22,14:00,0,0,1,0,2,0,0,0,2014,1,14,Wednesday
1/22/2014 15:00,2014-01-22,15:00,1,1,0,0,1,0,0,1,2014,1,15,Wednesday
1/22/2014 16:00,2014-01-22,16:00,1,1,0,3.4,1,0,0,0,2014,1,16,Wednesday
1/22/2014 17:00,2014-01-22,17:00,0,0,1.3,3,0,0,0,0,2014,1,17,Wednesday
1/22/2014 18:00,2014-01-22,18:00,0,0,0,0,1,0,0,0,2014,1,18,Wednesday
1/22/2014 19:00,2014-01-22,19:00,0,1,0,1,2,0,0,0,2014,1,19,Wednesday
1/22/2014 20:00,2014-01-22,20:00,2,0,0,1,1,0,0,0,2014,1,20,Wednesday
1/22/2014 21:00,2014-01-22,21:00,0,0,0,0,0,0,0,0,2014,1,21,Wednesday
1/22/2014 22:00,2014-01-22,22:00,0,0,0,0,0,0,0,0,2014,1,22,Wednesday
1/22/2014 23:00,2014-01-22,23:00,0,0,0,0,0,0,0,0,2014,1,23,Wednesday
1/23/2014 0:00,2014-01-23,00:00,0,0,0,0,0,0,0,0,2014,1,0,Thursday
1/23/2014 1:00,2014-01-23,01:00,0,0,0,0,0,0,0,0,2014,1,1,Thursday
1/23/2014 2:00,2014-01-23,02:00,0,0,0,0,0,0,0,0,2014,1,2,Thursday
1/23/2014 3:00,2014-01-23,03:00,0,0,0,0,0,0,0,0,2014,1,3,Thursday
1/23/2014 4:00,2014-01-23,04:00,0,0,0,0,0,0,0,0,2014,1,4,Thursday
1/23/2014 5:00,2014-01-23,05:00,0,0,0,0,0,0,0,0,2014,1,5,Thursday
1/23/2014 6:00,2014-01-23,06:00,0,0,0,0,0,0,0,0,2014,1,6,Thursday
1/23/2014 7:00,2014-01-23,07:00,0,0,0,0,0,0,0,0,2014,1,7,Thursday
1/23/2014 8:00,2014-01-23,08:00,0,0,0,0,0,0,0,0,2014,1,8,Thursday
1/23/2014 9:00,2014-01-23,09:00,0,0,0,0,0,0,0,0,2014,1,9,Thursday
1/23/2014 10:00,2014-01-23,10:00,0,0,0,4,0,0,0,0,2014,1,10,Thursday
1/23/2014 11:00,2014-01-23,11:00,1,0,2,1,0,0,0,0,2014,1,11,Thursday
1/23/2014 12:00,2014-01-23,12:00,0,0.34,1.2,0,0,2,0,0,2014,1,12,Thursday
1/23/2014 13:00,2014-01-23,13:00,0,0,1,3.2,0,0,0,0,2014,1,13,Thursday
1/23/2014 14:00,2014-01-23,14:00,0,0,0,1,1,0,0,0,2014,1,14,Thursday
1/23/2014 15:00,2014-01-23,15:00,0,2.33,0,1,0,1,0,0,2014,1,15,Thursday
1/23/2014 16:00,2014-01-23,16:00,0,1,0,2,1,0,0,0,2014,1,16,Thursday
1/23/2014 17:00,2014-01-23,17:00,1,0,0,9,0,0,0,0,2014,1,17,Thursday
1/23/2014 18:00,2014-01-23,18:00,1,0,0,1,0,0,1,0,2014,1,18,Thursday
1/23/2014 19:00,2014-01-23,19:00,1,0,1,1,0,0,0,0,2014,1,19,Thursday
1/23/2014 20:00,2014-01-23,20:00,0,1,0,3,0,0,0,3,2014,1,20,Thursday
1/23/2014 21:00,2014-01-23,21:00,0,0,0,0,0,0,0,0,2014,1,21,Thursday
1/23/2014 22:00,2014-01-23,22:00,0,0,0,0,0,0,0,0,2014,1,22,Thursday
1/23/2014 23:00,2014-01-23,23:00,0,0,0,0,0,0,0,0,2014,1,23,Thursday
1/24/2014 0:00,2014-01-24,00:00,0,0,0,0,0,0,0,0,2014,1,0,Friday
1/24/2014 1:00,2014-01-24,01:00,0,0,0,0,0,0,0,0,2014,1,1,Friday
1/24/2014 2:00,2014-01-24,02:00,0,0,0,0,0,0,0,0,2014,1,2,Friday
1/24/2014 3:00,2014-01-24,03:00,0,0,0,0,0,0,0,0,2014,1,3,Friday
1/24/2014 4:00,2014-01-24,04:00,0,0,0,0,0,0,0,0,2014,1,4,Friday
1/24/2014 5:00,2014-01-24,05:00,0,0,0,0,0,0,0,0,2014,1,5,Friday
1/24/2014 6:00,2014-01-24,06:00,0,0,0,0,0,0,0,0,2014,1,6,Friday
1/24/2014 7:00,2014-01-24,07:00,0,0,0,0,0,0,0,0,2014,1,7,Friday
1/24/2014 8:00,2014-01-24,08:00,0,0,0,3,1,0,0,0,2014,1,8,Friday
1/24/2014 9:00,2014-01-24,09:00,2,0,1,1,1,0,0,0,2014,1,9,Friday
1/24/2014 10:00,2014-01-24,10:00,0.34,1,1,1,1,0,0,0,2014,1,10,Friday
1/24/2014 11:00,2014-01-24,11:00,0.33,0,0,8,2,0,0,0,2014,1,11,Friday
1/24/2014 12:00,2014-01-24,12:00,0,0.34,1,1.6,0,0,0,0,2014,1,12,Friday
1/24/2014 13:00,2014-01-24,13:00,0,0,0,0,0,0,0,0,2014,1,13,Friday
1/24/2014 14:00,2014-01-24,14:00,0,0,0,0,3,0,0,0,2014,1,14,Friday
1/24/2014 15:00,2014-01-24,15:00,0,0,4,0,1,0,0,0,2014,1,15,Friday
1/24/2014 16:00,2014-01-24,16:00,1,1,0,1,0,0,0,0,2014,1,16,Friday
1/24/2014 17:00,2014-01-24,17:00,1,2,0,1,3,1,0,0,2014,1,17,Friday
1/24/2014 18:00,2014-01-24,18:00,0,2,0,1,1,0,0,0,2014,1,18,Friday
1/24/2014 19:00,2014-01-24,19:00,0,1,0,1,0,0,0,0,2014,1,19,Friday
1/24/2014 20:00,2014-01-24,20:00,0,0,0,1,0,0,0,0,2014,1,20,Friday
1/24/2014 21:00,2014-01-24,21:00,0,0,0,0,0,0,0,0,2014,1,21,Friday
1/24/2014 22:00,2014-01-24,22:00,0,0,0,0,0,0,0,0,2014,1,22,Friday
1/24/2014 23:00,2014-01-24,23:00,0,0,0,0,0,0,0,0,2014,1,23,Friday
1/25/2014 0:00,2014-01-25,00:00,0,0,0,0,0,0,0,0,2014,1,0,Saturday
1/25/2014 1:00,2014-01-25,01:00,0,0,0,0,0,0,0,0,2014,1,1,Saturday
1/25/2014 2:00,2014-01-25,02:00,0,0,0,0,0,0,0,0,2014,1,2,Saturday
1/25/2014 3:00,2014-01-25,03:00,0,0,0,0,0,0,0,0,2014,1,3,Saturday
1/25/2014 4:00,2014-01-25,04:00,0,0,0,0,0,0,0,0,2014,1,4,Saturday
1/25/2014 5:00,2014-01-25,05:00,0,0,0,0,0,0,0,0,2014,1,5,Saturday
1/25/2014 6:00,2014-01-25,06:00,0,0,0,0,0,0,0,0,2014,1,6,Saturday
1/25/2014 7:00,2014-01-25,07:00,0,0,0,0,0,0,0,0,2014,1,7,Saturday
1/25/2014 8:00,2014-01-25,08:00,0,0,0,1,0,0,0,1,2014,1,8,Saturday
1/25/2014 9:00,2014-01-25,09:00,0,1,0,1,0,0,0,0,2014,1,9,Saturday
1/25/2014 10:00,2014-01-25,10:00,0,2,0,5,0,0,0,0,2014,1,10,Saturday
1/25/2014 11:00,2014-01-25,11:00,2,0,1,16,5,0,0,0,2014,1,11,Saturday
1/25/2014 12:00,2014-01-25,12:00,1,0,0,2,2,0,5,0,2014,1,12,Saturday
1/25/2014 13:00,2014-01-25,13:00,1,2,1,3,5,0,0,0,2014,1,13,Saturday
1/25/2014 14:00,2014-01-25,14:00,0,0,2,0,4,0,0,0,2014,1,14,Saturday
1/25/2014 15:00,2014-01-25,15:00,1,1,0,1,0,0,0,0,2014,1,15,Saturday
1/25/2014 16:00,2014-01-25,16:00,1,2,0,2.3,0,0,0,0,2014,1,16,Saturday
1/25/2014 17:00,2014-01-25,17:00,0,1,0,1,0,0,0,0,2014,1,17,Saturday
1/25/2014 18:00,2014-01-25,18:00,0,0,1,5,1,0,0,0,2014,1,18,Saturday
1/25/2014 19:00,2014-01-25,19:00,0,0,0,0,1,0,0,0,2014,1,19,Saturday
1/25/2014 20:00,2014-01-25,20:00,0,0,0,0.5,0,0,0,0,2014,1,20,Saturday
1/25/2014 21:00,2014-01-25,21:00,0,0,0,0,0,0,0,0,2014,1,21,Saturday
1/25/2014 22:00,2014-01-25,22:00,0,0,0,0,0,0,0,0,2014,1,22,Saturday
1/25/2014 23:00,2014-01-25,23:00,0,0,0,0,0,0,0,0,2014,1,23,Saturday
1/26/2014 0:00,2014-01-26,00:00,0,0,0,0,0,0,0,0,2014,1,0,Sunday
1/26/2014 1:00,2014-01-26,01:00,0,0,0,0,0,0,0,0,2014,1,1,Sunday
1/26/2014 2:00,2014-01-26,02:00,0,0,0,0,0,0,0,0,2014,1,2,Sunday
1/26/2014 3:00,2014-01-26,03:00,0,0,0,0,0,0,0,0,2014,1,3,Sunday
1/26/2014 4:00,2014-01-26,04:00,0,0,0,0,0,0,0,0,2014,1,4,Sunday
1/26/2014 5:00,2014-01-26,05:00,0,0,0,0,0,0,0,0,2014,1,5,Sunday
1/26/2014 6:00,2014-01-26,06:00,0,0,0,0,0,0,0,0,2014,1,6,Sunday
1/26/2014 7:00,2014-01-26,07:00,0,0,0,0,0,0,0,0,2014,1,7,Sunday
1/26/2014 8:00,2014-01-26,08:00,0,0,0,8,0,0,0,0,2014,1,8,Sunday
1/26/2014 9:00,2014-01-26,09:00,0,0,0,0,1,0,0,0,2014,1,9,Sunday
1/26/2014 10:00,2014-01-26,10:00,0.33,0.68,0,5,1,0,0,0,2014,1,10,Sunday
1/26/2014 11:00,2014-01-26,11:00,2,0,0,2,1,0,0,0,2014,1,11,Sunday
1/26/2014 12:00,2014-01-26,12:00,0,0,0,7,0,0,0,0,2014,1,12,Sunday
1/26/2014 13:00,2014-01-26,13:00,2,1,0,2,1,0,0,0,2014,1,13,Sunday
1/26/2014 14:00,2014-01-26,14:00,0,0,0,0,0,0,0,0,2014,1,14,Sunday
1/26/2014 15:00,2014-01-26,15:00,0,0,0,0,0,0,0,0,2014,1,15,Sunday
1/26/2014 16:00,2014-01-26,16:00,0,0,0,0,0,0,0,0,2014,1,16,Sunday
1/26/2014 17:00,2014-01-26,17:00,0,0,0,0,0,0,0,0,2014,1,17,Sunday
1/26/2014 18:00,2014-01-26,18:00,0,0,0,0,0,0,0,0,2014,1,18,Sunday
1/26/2014 19:00,2014-01-26,19:00,0,0,0,0,0,0,0,0,2014,1,19,Sunday
1/26/2014 20:00,2014-01-26,20:00,0,0,0,0,0,0,0,0,2014,1,20,Sunday
1/26/2014 21:00,2014-01-26,21:00,0,0,0,0,0,0,0,0,2014,1,21,Sunday
1/26/2014 22:00,2014-01-26,22:00,0,0,0,0,0,0,0,0,2014,1,22,Sunday
1/26/2014 23:00,2014-01-26,23:00,0,0,0,0,0,0,0,0,2014,1,23,Sunday
1/27/2014 0:00,2014-01-27,00:00,0,0,0,0,0,0,0,0,2014,1,0,Monday
1/27/2014 1:00,2014-01-27,01:00,0,0,0,0,0,0,0,0,2014,1,1,Monday
1/27/2014 2:00,2014-01-27,02:00,0,0,0,0,0,0,0,0,2014,1,2,Monday
1/27/2014 3:00,2014-01-27,03:00,0,0,0,0,0,0,0,0,2014,1,3,Monday
1/27/2014 4:00,2014-01-27,04:00,0,0,0,0,0,0,0,0,2014,1,4,Monday
1/27/2014 5:00,2014-01-27,05:00,0,0,0,0,0,0,0,0,2014,1,5,Monday
1/27/2014 6:00,2014-01-27,06:00,0,0,0,0,0,0,0,0,2014,1,6,Monday
1/27/2014 7:00,2014-01-27,07:00,0,0,0,0,0,0,0,0,2014,1,7,Monday
1/27/2014 8:00,2014-01-27,08:00,0,0.34,0,2,0,0,0,0,2014,1,8,Monday
1/27/2014 9:00,2014-01-27,09:00,0,0,0,3,0,0,1,0,2014,1,9,Monday
1/27/2014 10:00,2014-01-27,10:00,0,0,0,1,4,0,0,1,2014,1,10,Monday
1/27/2014 11:00,2014-01-27,11:00,0,1.33,1,1,1,0,0,0,2014,1,11,Monday
1/27/2014 12:00,2014-01-27,12:00,0,1,0,7,3,0,0,0,2014,1,12,Monday
1/27/2014 13:00,2014-01-27,13:00,1,0,0,3,5,0,0,0,2014,1,13,Monday
1/27/2014 14:00,2014-01-27,14:00,2,0,0,1,0,1,0,0,2014,1,14,Monday
1/27/2014 15:00,2014-01-27,15:00,0,0,0,1,2,0,0,0,2014,1,15,Monday
1/27/2014 16:00,2014-01-27,16:00,0,1,0.2,2.1,0,1,0,0,2014,1,16,Monday
1/27/2014 17:00,2014-01-27,17:00,0,1,0,0,0,0,0,1,2014,1,17,Monday
1/27/2014 18:00,2014-01-27,18:00,0,0,0,0,1,0,0,0,2014,1,18,Monday
1/27/2014 19:00,2014-01-27,19:00,0,0,0,0,1,0,0,0,2014,1,19,Monday
1/27/2014 20:00,2014-01-27,20:00,0,0,0,1.5,0,0,0,1,2014,1,20,Monday
1/27/2014 21:00,2014-01-27,21:00,1.34,0,0,1,0,0,0,0,2014,1,21,Monday
1/27/2014 22:00,2014-01-27,22:00,0,0,0,0,0,0,0,0,2014,1,22,Monday
1/27/2014 23:00,2014-01-27,23:00,0,0,0,0,0,0,0,0,2014,1,23,Monday
1/28/2014 0:00,2014-01-28,00:00,0,0,0,0,0,0,0,0,2014,1,0,Tuesday
1/28/2014 1:00,2014-01-28,01:00,0,0,0,0,0,0,0,0,2014,1,1,Tuesday
1/28/2014 2:00,2014-01-28,02:00,0,0,0,0,0,0,0,0,2014,1,2,Tuesday
1/28/2014 3:00,2014-01-28,03:00,0,0,0,0,0,0,0,0,2014,1,3,Tuesday
1/28/2014 4:00,2014-01-28,04:00,0,0,0,0,0,0,0,0,2014,1,4,Tuesday
1/28/2014 5:00,2014-01-28,05:00,0,0,0,0,0,0,0,0,2014,1,5,Tuesday
1/28/2014 6:00,2014-01-28,06:00,0,0,0,0,0,0,0,0,2014,1,6,Tuesday
1/28/2014 7:00,2014-01-28,07:00,0,0,0,0,0,0,0,0,2014,1,7,Tuesday
1/28/2014 8:00,2014-01-28,08:00,0,0,0,0,0,0,0,0,2014,1,8,Tuesday
1/28/2014 9:00,2014-01-28,09:00,0,0,0,1,7,3,1,1,2014,1,9,Tuesday
1/28/2014 10:00,2014-01-28,10:00,1,0,0,0,1,0,0,0,2014,1,10,Tuesday
1/28/2014 11:00,2014-01-28,11:00,0,0,0,0,2,0,0,0,2014,1,11,Tuesday
1/28/2014 12:00,2014-01-28,12:00,2,0,0.2,0,0,0,0,0,2014,1,12,Tuesday
1/28/2014 13:00,2014-01-28,13:00,0,0,0.6,8,1,0,0,0,2014,1,13,Tuesday
1/28/2014 14:00,2014-01-28,14:00,0,0,0,1.28,2,0,0,0,2014,1,14,Tuesday
1/28/2014 15:00,2014-01-28,15:00,1,0,0,1,3,0,0,0,2014,1,15,Tuesday
1/28/2014 16:00,2014-01-28,16:00,0,0,1,0,1,2,0,0,2014,1,16,Tuesday
1/28/2014 17:00,2014-01-28,17:00,1,1.34,0,1,1,0,0,4,2014,1,17,Tuesday
1/28/2014 18:00,2014-01-28,18:00,0,1,1,0,1,0,0,0,2014,1,18,Tuesday
1/28/2014 19:00,2014-01-28,19:00,1,0,0,1.1,0,0,0,0,2014,1,19,Tuesday
1/28/2014 20:00,2014-01-28,20:00,0,0,0,0,1,0,0,0,2014,1,20,Tuesday
1/28/2014 21:00,2014-01-28,21:00,0,1,0,0,2,0,0,0,2014,1,21,Tuesday
1/28/2014 22:00,2014-01-28,22:00,0,0,0,0,0,0,0,0,2014,1,22,Tuesday
1/28/2014 23:00,2014-01-28,23:00,0,0,0,0,0,0,0,0,2014,1,23,Tuesday
1/29/2014 0:00,2014-01-29,00:00,0,0,0,0,0,0,0,0,2014,1,0,Wednesday
1/29/2014 1:00,2014-01-29,01:00,0,0,0,0,0,0,0,0,2014,1,1,Wednesday
1/29/2014 2:00,2014-01-29,02:00,0,0,0,0,0,0,0,0,2014,1,2,Wednesday
1/29/2014 3:00,2014-01-29,03:00,0,0,0,0,0,0,0,0,2014,1,3,Wednesday
1/29/2014 4:00,2014-01-29,04:00,0,0,0,0,0,0,0,0,2014,1,4,Wednesday
1/29/2014 5:00,2014-01-29,05:00,0,0,0,0,0,0,0,0,2014,1,5,Wednesday
1/29/2014 6:00,2014-01-29,06:00,0,0,0,0,0,0,0,0,2014,1,6,Wednesday
1/29/2014 7:00,2014-01-29,07:00,0,0,0,0,0,0,0,0,2014,1,7,Wednesday
1/29/2014 8:00,2014-01-29,08:00,0,0,0,0,0,0,0,0,2014,1,8,Wednesday
1/29/2014 9:00,2014-01-29,09:00,0,0,0,1,1,0,0,0,2014,1,9,Wednesday
1/29/2014 10:00,2014-01-29,10:00,1.33,0,0,1,0,0,0,0,2014,1,10,Wednesday
1/29/2014 11:00,2014-01-29,11:00,0,0,0,1,2,0,0,0,2014,1,11,Wednesday
1/29/2014 12:00,2014-01-29,12:00,0,0,0,1,2,0,0,0,2014,1,12,Wednesday
1/29/2014 13:00,2014-01-29,13:00,0,0,0,1,0,0,0,0,2014,1,13,Wednesday
1/29/2014 14:00,2014-01-29,14:00,0,0,1,2,0,0,1,0,2014,1,14,Wednesday
1/29/2014 15:00,2014-01-29,15:00,0,1,0,0,2,0,0,0,2014,1,15,Wednesday
1/29/2014 16:00,2014-01-29,16:00,0,0,0,0,0,0,0,1,2014,1,16,Wednesday
1/29/2014 17:00,2014-01-29,17:00,1,2,0,2,1,1,0,0,2014,1,17,Wednesday
1/29/2014 18:00,2014-01-29,18:00,0,0,0,5,1,0,0,0,2014,1,18,Wednesday
1/29/2014 19:00,2014-01-29,19:00,1,1,0,0,0,0,0,0,2014,1,19,Wednesday
1/29/2014 20:00,2014-01-29,20:00,2,0,0,0,1,0,0,1,2014,1,20,Wednesday
1/29/2014 21:00,2014-01-29,21:00,0,0,1,0,0,0,0,0,2014,1,21,Wednesday
1/29/2014 22:00,2014-01-29,22:00,0,0,0,0,0,0,0,0,2014,1,22,Wednesday
1/29/2014 23:00,2014-01-29,23:00,0,0,0,0,0,0,0,0,2014,1,23,Wednesday
1/30/2014 0:00,2014-01-30,00:00,0,0,0,0,0,0,0,0,2014,1,0,Thursday
1/30/2014 1:00,2014-01-30,01:00,0,0,0,0,0,0,0,0,2014,1,1,Thursday
1/30/2014 2:00,2014-01-30,02:00,0,0,0,0,0,0,0,0,2014,1,2,Thursday
1/30/2014 3:00,2014-01-30,03:00,0,0,0,0,0,0,0,0,2014,1,3,Thursday
1/30/2014 4:00,2014-01-30,04:00,0,0,0,0,0,0,0,0,2014,1,4,Thursday
1/30/2014 5:00,2014-01-30,05:00,0,0,0,0,0,0,0,0,2014,1,5,Thursday
1/30/2014 6:00,2014-01-30,06:00,0,0,0,0,0,0,0,0,2014,1,6,Thursday
1/30/2014 7:00,2014-01-30,07:00,0,0,0,0,0,0,0,0,2014,1,7,Thursday
1/30/2014 8:00,2014-01-30,08:00,0,0,0,0.6,1,0,2,0,2014,1,8,Thursday
1/30/2014 9:00,2014-01-30,09:00,0,0,0,1,1,0,0,0,2014,1,9,Thursday
1/30/2014 10:00,2014-01-30,10:00,0,0,0,1,3,0,0,0,2014,1,10,Thursday
1/30/2014 11:00,2014-01-30,11:00,0.34,0,0,1,1,0,0,0,2014,1,11,Thursday
1/30/2014 12:00,2014-01-30,12:00,0,1,0,13,0,0,1,0,2014,1,12,Thursday
1/30/2014 13:00,2014-01-30,13:00,0,0,0,1,0,0,0,1,2014,1,13,Thursday
1/30/2014 14:00,2014-01-30,14:00,0.34,0,1,2,1,0,0,0,2014,1,14,Thursday
1/30/2014 15:00,2014-01-30,15:00,1,0.34,0,2,0,1,0,1,2014,1,15,Thursday
1/30/2014 16:00,2014-01-30,16:00,0.34,0,1,0.9,0,0,0,0,2014,1,16,Thursday
1/30/2014 17:00,2014-01-30,17:00,0,0,0,0,0,0,0,0,2014,1,17,Thursday
1/30/2014 18:00,2014-01-30,18:00,0,0,0,3,0,0,0,0,2014,1,18,Thursday
1/30/2014 19:00,2014-01-30,19:00,0,0,0,0,0,0,0,0,2014,1,19,Thursday
1/30/2014 20:00,2014-01-30,20:00,1,0,0,0,0,0,0,0,2014,1,20,Thursday
1/30/2014 21:00,2014-01-30,21:00,0,0,0,0,0,0,0,0,2014,1,21,Thursday
1/30/2014 22:00,2014-01-30,22:00,0,0,0.4,0,0,0,0,0,2014,1,22,Thursday
1/30/2014 23:00,2014-01-30,23:00,0,0,0,0,0,0,0,0,2014,1,23,Thursday
1/31/2014 0:00,2014-01-31,00:00,0,0,0,0,0,0,0,0,2014,1,0,Friday
1/31/2014 1:00,2014-01-31,01:00,0,0,0,0,0,0,0,0,2014,1,1,Friday
1/31/2014 2:00,2014-01-31,02:00,0,0,0,0,0,0,0,0,2014,1,2,Friday
1/31/2014 3:00,2014-01-31,03:00,0,0,0,0,0,0,0,0,2014,1,3,Friday
1/31/2014 4:00,2014-01-31,04:00,0,0,0,0,0,0,0,0,2014,1,4,Friday
1/31/2014 5:00,2014-01-31,05:00,0,0,0,0,0,0,0,0,2014,1,5,Friday
1/31/2014 6:00,2014-01-31,06:00,0,0,0,0,0,0,0,0,2014,1,6,Friday
1/31/2014 7:00,2014-01-31,07:00,0,0,0,0,0,0,0,0,2014,1,7,Friday
1/31/2014 8:00,2014-01-31,08:00,0,0,0,0,0,0,0,0,2014,1,8,Friday
1/31/2014 9:00,2014-01-31,09:00,0,0,0.2,2,0,0,0,0,2014,1,9,Friday
1/31/2014 10:00,2014-01-31,10:00,0,0,2,8,0,0,0,0,2014,1,10,Friday
1/31/2014 11:00,2014-01-31,11:00,0,0.34,1,1,0,0,0,0,2014,1,11,Friday
1/31/2014 12:00,2014-01-31,12:00,0,1,1.7,4,0,0,0,0,2014,1,12,Friday
1/31/2014 13:00,2014-01-31,13:00,0,0,0,0,0,0,0,0,2014,1,13,Friday
1/31/2014 14:00,2014-01-31,14:00,0,0,0,0.6,3,0,0,0,2014,1,14,Friday
1/31/2014 15:00,2014-01-31,15:00,0,0,0,1,2,0,0,0,2014,1,15,Friday
1/31/2014 16:00,2014-01-31,16:00,1,0.34,0.2,4.3,2,0,0,0,2014,1,16,Friday
1/31/2014 17:00,2014-01-31,17:00,0,0,0,0,0,0,0,0,2014,1,17,Friday
1/31/2014 18:00,2014-01-31,18:00,0,0,0,0,0,0,0,0,2014,1,18,Friday
1/31/2014 19:00,2014-01-31,19:00,0,0,0,5,0,0,0,0,2014,1,19,Friday
1/31/2014 20:00,2014-01-31,20:00,0,1,1,0,0,0,1,0,2014,1,20,Friday
1/31/2014 21:00,2014-01-31,21:00,0,0,1,1,2,0,0,0,2014,1,21,Friday
1/31/2014 22:00,2014-01-31,22:00,0,0,0,0,0,0,0,0,2014,1,22,Friday
1/31/2014 23:00,2014-01-31,23:00,0,0,0,0,0,0,0,0,2014,1,23,Friday
2/1/2014 0:00,2014-02-01,00:00,0,0,0,0,0,0,0,0,2014,2,0,Saturday
2/1/2014 1:00,2014-02-01,01:00,0,0,0,0,0,0,0,0,2014,2,1,Saturday
2/1/2014 2:00,2014-02-01,02:00,0,0,0,0,0,0,0,0,2014,2,2,Saturday
2/1/2014 3:00,2014-02-01,03:00,0,0,0,0,0,0,0,0,2014,2,3,Saturday
2/1/2014 4:00,2014-02-01,04:00,0,0,0,0,0,0,0,0,2014,2,4,Saturday
2/1/2014 5:00,2014-02-01,05:00,0,0,0,0,0,0,0,0,2014,2,5,Saturday
2/1/2014 6:00,2014-02-01,06:00,0,0,0,0,0,0,0,0,2014,2,6,Saturday
2/1/2014 7:00,2014-02-01,07:00,0,0,0,0,1,0,0,0,2014,2,7,Saturday
2/1/2014 8:00,2014-02-01,08:00,0,0,0,0,0,0,1,0,2014,2,8,Saturday
2/1/2014 9:00,2014-02-01,09:00,0,0,1,0,0,0,0,0,2014,2,9,Saturday
2/1/2014 10:00,2014-02-01,10:00,0,1,1,3,1,0,0,0,2014,2,10,Saturday
2/1/2014 11:00,2014-02-01,11:00,1,0,1,1,0,0,0,0,2014,2,11,Saturday
2/1/2014 12:00,2014-02-01,12:00,0.33,0,1,2,0,0,0,0,2014,2,12,Saturday
2/1/2014 13:00,2014-02-01,13:00,0,0,0,1,1,1,0,0,2014,2,13,Saturday
2/1/2014 14:00,2014-02-01,14:00,0,0.66,0,3,7,0,0,0,2014,2,14,Saturday
2/1/2014 15:00,2014-02-01,15:00,0,0,0,0,1,0,0,0,2014,2,15,Saturday
2/1/2014 16:00,2014-02-01,16:00,0,2,0,9,0,0,0,0,2014,2,16,Saturday
2/1/2014 17:00,2014-02-01,17:00,1,0,0,3,0,0,10,0,2014,2,17,Saturday
2/1/2014 18:00,2014-02-01,18:00,1,0.66,0,6,1,0,0,0,2014,2,18,Saturday
2/1/2014 19:00,2014-02-01,19:00,1,0,1,3,0,0,3,0,2014,2,19,Saturday
2/1/2014 20:00,2014-02-01,20:00,0,0,0,12,1,0,0,0,2014,2,20,Saturday
2/1/2014 21:00,2014-02-01,21:00,0,0,0,0,0,0,0,0,2014,2,21,Saturday
2/1/2014 22:00,2014-02-01,22:00,0,0,0,0,0,0,0,0,2014,2,22,Saturday
2/1/2014 23:00,2014-02-01,23:00,0,0,0,0,0,0,0,0,2014,2,23,Saturday
2/2/2014 0:00,2014-02-02,00:00,0,0,0,0,0,0,0,0,2014,2,0,Sunday
2/2/2014 1:00,2014-02-02,01:00,0,0,0,0,0,0,0,0,2014,2,1,Sunday
2/2/2014 2:00,2014-02-02,02:00,0,0,0,0,0,0,0,0,2014,2,2,Sunday
2/2/2014 3:00,2014-02-02,03:00,0,0,0,0,0,0,0,0,2014,2,3,Sunday
2/2/2014 4:00,2014-02-02,04:00,0,0,0,0,0,0,0,0,2014,2,4,Sunday
2/2/2014 5:00,2014-02-02,05:00,0,0,0,0,0,0,0,0,2014,2,5,Sunday
2/2/2014 6:00,2014-02-02,06:00,0,0,0,0,0,0,0,0,2014,2,6,Sunday
2/2/2014 7:00,2014-02-02,07:00,0,0,0,0,0,0,0,0,2014,2,7,Sunday
2/2/2014 8:00,2014-02-02,08:00,1,0,0,0,1,0,0,0,2014,2,8,Sunday
2/2/2014 9:00,2014-02-02,09:00,1,0,0,2.5,0,0,8,0,2014,2,9,Sunday
2/2/2014 10:00,2014-02-02,10:00,2,1,0,2,3,0,0,0,2014,2,10,Sunday
2/2/2014 11:00,2014-02-02,11:00,1,0,0,1,1,2,0,0,2014,2,11,Sunday
2/2/2014 12:00,2014-02-02,12:00,2,1,0.2,5,1,0,0,0,2014,2,12,Sunday
2/2/2014 13:00,2014-02-02,13:00,0,1,0,3,0,0,0,0,2014,2,13,Sunday
2/2/2014 14:00,2014-02-02,14:00,0,0,0,0,0,0,0,0,2014,2,14,Sunday
2/2/2014 15:00,2014-02-02,15:00,0,0,0,0,0,0,0,0,2014,2,15,Sunday
2/2/2014 16:00,2014-02-02,16:00,0,0,0,0,0,0,0,0,2014,2,16,Sunday
2/2/2014 17:00,2014-02-02,17:00,0,0,0,0,0,0,0,0,2014,2,17,Sunday
2/2/2014 18:00,2014-02-02,18:00,0,0,0,0,0,0,0,0,2014,2,18,Sunday
2/2/2014 19:00,2014-02-02,19:00,0,0,0,0,0,0,0,0,2014,2,19,Sunday
2/2/2014 20:00,2014-02-02,20:00,0,0,0,0,0,0,0,0,2014,2,20,Sunday
2/2/2014 21:00,2014-02-02,21:00,0,0,0,0,0,0,0,0,2014,2,21,Sunday
2/2/2014 22:00,2014-02-02,22:00,0,0,0,0,0,0,0,0,2014,2,22,Sunday
2/2/2014 23:00,2014-02-02,23:00,0,0,0,0,0,0,0,0,2014,2,23,Sunday
2/3/2014 0:00,2014-02-03,00:00,0,0,0,0,0,0,0,0,2014,2,0,Monday
2/3/2014 1:00,2014-02-03,01:00,0,0,0,0,0,0,0,0,2014,2,1,Monday
2/3/2014 2:00,2014-02-03,02:00,0,0,0,0,0,0,0,0,2014,2,2,Monday
2/3/2014 3:00,2014-02-03,03:00,0,0,0,0,0,0,0,0,2014,2,3,Monday
2/3/2014 4:00,2014-02-03,04:00,0,0,0,0,0,0,0,0,2014,2,4,Monday
2/3/2014 5:00,2014-02-03,05:00,0,0,0,0,0,0,0,0,2014,2,5,Monday
2/3/2014 6:00,2014-02-03,06:00,0,0,0,0,0,0,0,0,2014,2,6,Monday
2/3/2014 7:00,2014-02-03,07:00,0,0,0,0,0,0,0,0,2014,2,7,Monday
2/3/2014 8:00,2014-02-03,08:00,0,1,1,8,0,0,0,0,2014,2,8,Monday
2/3/2014 9:00,2014-02-03,09:00,0,0,1,1,0,0,0,0,2014,2,9,Monday
2/3/2014 10:00,2014-02-03,10:00,1,0,0,0,1,0,0,0,2014,2,10,Monday
2/3/2014 11:00,2014-02-03,11:00,0,0,1,0,2,0,0,0,2014,2,11,Monday
2/3/2014 12:00,2014-02-03,12:00,0,0,0,5,1,0,0,0,2014,2,12,Monday
2/3/2014 13:00,2014-02-03,13:00,0,0,1,1,3,0,0,0,2014,2,13,Monday
2/3/2014 14:00,2014-02-03,14:00,0,0,0,0,1,0,0,0,2014,2,14,Monday
2/3/2014 15:00,2014-02-03,15:00,0,0,1,3,1,0,0,0,2014,2,15,Monday
2/3/2014 16:00,2014-02-03,16:00,1,0,1,1,2,0,0,0,2014,2,16,Monday
2/3/2014 17:00,2014-02-03,17:00,0,0,0,0.2,2,0,0,0,2014,2,17,Monday
2/3/2014 18:00,2014-02-03,18:00,1,0,2,2,1,1,1,0,2014,2,18,Monday
2/3/2014 19:00,2014-02-03,19:00,1,0,0.5,8,0,0,0,0,2014,2,19,Monday
2/3/2014 20:00,2014-02-03,20:00,0,0,0,3.2,1,0,0,0,2014,2,20,Monday
2/3/2014 21:00,2014-02-03,21:00,1,0,0,0,1,0,0,0,2014,2,21,Monday
2/3/2014 22:00,2014-02-03,22:00,0,0,0,0,0,0,0,0,2014,2,22,Monday
2/3/2014 23:00,2014-02-03,23:00,0,0,0,0,0,0,0,0,2014,2,23,Monday
2/4/2014 0:00,2014-02-04,00:00,0,0,0,0,0,0,0,0,2014,2,0,Tuesday
2/4/2014 1:00,2014-02-04,01:00,0,0,0,0,0,0,0,0,2014,2,1,Tuesday
2/4/2014 2:00,2014-02-04,02:00,0,0,0,0,0,0,0,0,2014,2,2,Tuesday
2/4/2014 3:00,2014-02-04,03:00,0,0,0,0,0,0,0,0,2014,2,3,Tuesday
2/4/2014 4:00,2014-02-04,04:00,0,0,0,0,0,0,0,0,2014,2,4,Tuesday
2/4/2014 5:00,2014-02-04,05:00,0,0,0,0,0,0,0,0,2014,2,5,Tuesday
2/4/2014 6:00,2014-02-04,06:00,0,0,0,0,0,0,0,0,2014,2,6,Tuesday
2/4/2014 7:00,2014-02-04,07:00,0,0,0,0,0,0,0,0,2014,2,7,Tuesday
2/4/2014 8:00,2014-02-04,08:00,0,0,1.5,0,2,0,0,0,2014,2,8,Tuesday
2/4/2014 9:00,2014-02-04,09:00,1,0,0,4.4,0,0,0,0,2014,2,9,Tuesday
2/4/2014 10:00,2014-02-04,10:00,0,0,0,3,1,0,0,1,2014,2,10,Tuesday
2/4/2014 11:00,2014-02-04,11:00,0,0,2,1,0,0,0,0,2014,2,11,Tuesday
2/4/2014 12:00,2014-02-04,12:00,0.33,0,1,2,0,0,11,0,2014,2,12,Tuesday
2/4/2014 13:00,2014-02-04,13:00,0,1,0,4,0,1,0,0,2014,2,13,Tuesday
2/4/2014 14:00,2014-02-04,14:00,0,0,1,6,1,0,1,1,2014,2,14,Tuesday
2/4/2014 15:00,2014-02-04,15:00,0,0,0.5,1,0,0,0,0,2014,2,15,Tuesday
2/4/2014 16:00,2014-02-04,16:00,0,0,0,0,0,0,0,0,2014,2,16,Tuesday
2/4/2014 17:00,2014-02-04,17:00,0,0,1,1,1,0,0,0,2014,2,17,Tuesday
2/4/2014 18:00,2014-02-04,18:00,0,0,0,1.6,1,0,5,0,2014,2,18,Tuesday
2/4/2014 19:00,2014-02-04,19:00,0,1,0,2.6,2,0,0,0,2014,2,19,Tuesday
2/4/2014 20:00,2014-02-04,20:00,0,1,0,4,0,0,0,0,2014,2,20,Tuesday
2/4/2014 21:00,2014-02-04,21:00,0,0,0,0,0,0,0,0,2014,2,21,Tuesday
2/4/2014 22:00,2014-02-04,22:00,0,0,0,0,0,0,0,0,2014,2,22,Tuesday
2/4/2014 23:00,2014-02-04,23:00,0,0,0,0,0,0,0,0,2014,2,23,Tuesday
2/5/2014 0:00,2014-02-05,00:00,0,0,0,0,0,0,0,0,2014,2,0,Wednesday
2/5/2014 1:00,2014-02-05,01:00,0,0,0,0,0,0,0,0,2014,2,1,Wednesday
2/5/2014 2:00,2014-02-05,02:00,0,0,0,0,0,0,0,0,2014,2,2,Wednesday
2/5/2014 3:00,2014-02-05,03:00,0,0,0,0,0,0,0,0,2014,2,3,Wednesday
2/5/2014 4:00,2014-02-05,04:00,0,0,0,0,0,0,0,0,2014,2,4,Wednesday
2/5/2014 5:00,2014-02-05,05:00,0,0,0,0,0,0,0,0,2014,2,5,Wednesday
2/5/2014 6:00,2014-02-05,06:00,0,0,0,0,0,0,0,0,2014,2,6,Wednesday
2/5/2014 7:00,2014-02-05,07:00,0,0,0,0,0,0,0,0,2014,2,7,Wednesday
2/5/2014 8:00,2014-02-05,08:00,0,0,0,2,1,0,0,0,2014,2,8,Wednesday
2/5/2014 9:00,2014-02-05,09:00,0,0,0,1.2,2,0,0,0,2014,2,9,Wednesday
2/5/2014 10:00,2014-02-05,10:00,0,0,0,2,1,0,0,0,2014,2,10,Wednesday
2/5/2014 11:00,2014-02-05,11:00,0,0,1,3,0,0,0,1,2014,2,11,Wednesday
2/5/2014 12:00,2014-02-05,12:00,0,0,0,1,2,0,0,0,2014,2,12,Wednesday
2/5/2014 13:00,2014-02-05,13:00,1,1,1,2,0,0,0,0,2014,2,13,Wednesday
2/5/2014 14:00,2014-02-05,14:00,0,0,1,2.2,0,0,1,0,2014,2,14,Wednesday
2/5/2014 15:00,2014-02-05,15:00,0,0,0,5,0,0,0,0,2014,2,15,Wednesday
2/5/2014 16:00,2014-02-05,16:00,1,1,2,4,2,0,0,0,2014,2,16,Wednesday
2/5/2014 17:00,2014-02-05,17:00,1,0.34,0.2,1,2,0,0,0,2014,2,17,Wednesday
2/5/2014 18:00,2014-02-05,18:00,0,0,0,1,1,1,0,0,2014,2,18,Wednesday
2/5/2014 19:00,2014-02-05,19:00,0,0,0,1,3,0,0,0,2014,2,19,Wednesday
2/5/2014 20:00,2014-02-05,20:00,0,1.68,1,2,1,0,0,0,2014,2,20,Wednesday
2/5/2014 21:00,2014-02-05,21:00,0,0,0,5,0,0,0,0,2014,2,21,Wednesday
2/5/2014 22:00,2014-02-05,22:00,0,0,0,0,0,0,0,0,2014,2,22,Wednesday
2/5/2014 23:00,2014-02-05,23:00,0,0,0,0,0,0,0,0,2014,2,23,Wednesday
2/6/2014 0:00,2014-02-06,00:00,0,0,0,0,0,0,0,0,2014,2,0,Thursday
2/6/2014 1:00,2014-02-06,01:00,0,0,0,0,0,0,0,0,2014,2,1,Thursday
2/6/2014 2:00,2014-02-06,02:00,0,0,0,0,0,0,0,0,2014,2,2,Thursday
2/6/2014 3:00,2014-02-06,03:00,0,0,0,0,0,0,0,0,2014,2,3,Thursday
2/6/2014 4:00,2014-02-06,04:00,0,0,0,0,0,0,0,0,2014,2,4,Thursday
2/6/2014 5:00,2014-02-06,05:00,0,0,0,0,0,0,0,0,2014,2,5,Thursday
2/6/2014 6:00,2014-02-06,06:00,0,0,0,0,0,0,0,0,2014,2,6,Thursday
2/6/2014 7:00,2014-02-06,07:00,0,0,0,0,0,0,0,0,2014,2,7,Thursday
2/6/2014 8:00,2014-02-06,08:00,0,2,1,0,2,0,5,0,2014,2,8,Thursday
2/6/2014 9:00,2014-02-06,09:00,0,0,0,3,0,0,0,0,2014,2,9,Thursday
2/6/2014 10:00,2014-02-06,10:00,0,0,0,3,0,0,0,0,2014,2,10,Thursday
2/6/2014 11:00,2014-02-06,11:00,0.33,1,1,1.4,1,0,0,0,2014,2,11,Thursday
2/6/2014 12:00,2014-02-06,12:00,2,0,0,10,1,0,0,0,2014,2,12,Thursday
2/6/2014 13:00,2014-02-06,13:00,0,1.34,0,2,1,0,0,0,2014,2,13,Thursday
2/6/2014 14:00,2014-02-06,14:00,0,1,0,0,1,1,0,2,2014,2,14,Thursday
2/6/2014 15:00,2014-02-06,15:00,0,0,0,5,0,1,0,0,2014,2,15,Thursday
2/6/2014 16:00,2014-02-06,16:00,0,1,0,0,2,0,0,0,2014,2,16,Thursday
2/6/2014 17:00,2014-02-06,17:00,0,0,0,0,4,0,0,0,2014,2,17,Thursday
2/6/2014 18:00,2014-02-06,18:00,1,0.34,0,6,0,0,0,0,2014,2,18,Thursday
2/6/2014 19:00,2014-02-06,19:00,0,0,1.5,8,2,0,0,0,2014,2,19,Thursday
2/6/2014 20:00,2014-02-06,20:00,0,0,0,3,1,0,0,0,2014,2,20,Thursday
2/6/2014 21:00,2014-02-06,21:00,0,0,0,0,2,0,0,0,2014,2,21,Thursday
2/6/2014 22:00,2014-02-06,22:00,0,0,0,0,0,0,0,0,2014,2,22,Thursday
2/6/2014 23:00,2014-02-06,23:00,0,0,0,0,0,0,0,0,2014,2,23,Thursday
2/7/2014 0:00,2014-02-07,00:00,0,0,0,0,0,0,0,0,2014,2,0,Friday
2/7/2014 1:00,2014-02-07,01:00,0,0,0,0,0,0,0,0,2014,2,1,Friday
2/7/2014 2:00,2014-02-07,02:00,0,0,0,0,0,0,0,0,2014,2,2,Friday
2/7/2014 3:00,2014-02-07,03:00,0,0,0,0,0,0,0,0,2014,2,3,Friday
2/7/2014 4:00,2014-02-07,04:00,0,0,0,0,0,0,0,0,2014,2,4,Friday
2/7/2014 5:00,2014-02-07,05:00,0,0,0,0,0,0,0,0,2014,2,5,Friday
2/7/2014 6:00,2014-02-07,06:00,0,0,0,0,0,0,0,0,2014,2,6,Friday
2/7/2014 7:00,2014-02-07,07:00,0,0,0,0,0,0,0,0,2014,2,7,Friday
2/7/2014 8:00,2014-02-07,08:00,0,0,0,0,0,0,0,0,2014,2,8,Friday
2/7/2014 9:00,2014-02-07,09:00,0,0,1,6,1,0,0,0,2014,2,9,Friday
2/7/2014 10:00,2014-02-07,10:00,0.33,1.33,2,0,3,0,0,0,2014,2,10,Friday
2/7/2014 11:00,2014-02-07,11:00,0,2,0,0,0,1,0,0,2014,2,11,Friday
2/7/2014 12:00,2014-02-07,12:00,0,0,0.5,5,1,0,0,0,2014,2,12,Friday
2/7/2014 13:00,2014-02-07,13:00,0,0,1,1,1,0,0,0,2014,2,13,Friday
2/7/2014 14:00,2014-02-07,14:00,0,1,0,1,4,0,0,0,2014,2,14,Friday
2/7/2014 15:00,2014-02-07,15:00,0,1,3,1.2,2,0,0,0,2014,2,15,Friday
2/7/2014 16:00,2014-02-07,16:00,0,0,0,1,2,0,0,0,2014,2,16,Friday
2/7/2014 17:00,2014-02-07,17:00,0,1.34,1,1,0,0,0,0,2014,2,17,Friday
2/7/2014 18:00,2014-02-07,18:00,2,1,2,2.4,4,0,0,0,2014,2,18,Friday
2/7/2014 19:00,2014-02-07,19:00,0.33,0,0,1,0,0,0,0,2014,2,19,Friday
2/7/2014 20:00,2014-02-07,20:00,0,1,0.2,1.8,0,0,0,0,2014,2,20,Friday
2/7/2014 21:00,2014-02-07,21:00,0,0,1,0,1,0,0,0,2014,2,21,Friday
2/7/2014 22:00,2014-02-07,22:00,0,0,0,0,0,0,0,0,2014,2,22,Friday
2/7/2014 23:00,2014-02-07,23:00,0,0,0,0,0,0,0,0,2014,2,23,Friday
2/8/2014 0:00,2014-02-08,00:00,0,0,0,0,0,0,0,0,2014,2,0,Saturday
2/8/2014 1:00,2014-02-08,01:00,0,0,0,0,0,0,0,0,2014,2,1,Saturday
2/8/2014 2:00,2014-02-08,02:00,0,0,0,0,0,0,0,0,2014,2,2,Saturday
2/8/2014 3:00,2014-02-08,03:00,0,0,0,0,0,0,0,0,2014,2,3,Saturday
2/8/2014 4:00,2014-02-08,04:00,0,0,0,0,0,0,0,0,2014,2,4,Saturday
2/8/2014 5:00,2014-02-08,05:00,0,0,0,0,0,0,0,0,2014,2,5,Saturday
2/8/2014 6:00,2014-02-08,06:00,0,0,0,0,0,0,0,0,2014,2,6,Saturday
2/8/2014 7:00,2014-02-08,07:00,0,0,0,0,0,0,0,0,2014,2,7,Saturday
2/8/2014 8:00,2014-02-08,08:00,0,0,1,0,1,0,0,0,2014,2,8,Saturday
2/8/2014 9:00,2014-02-08,09:00,1.33,0,1,7,1,0,0,0,2014,2,9,Saturday
2/8/2014 10:00,2014-02-08,10:00,0,0,0,1,0,0,0,0,2014,2,10,Saturday
2/8/2014 11:00,2014-02-08,11:00,0,0,0,0,2,0,1,0,2014,2,11,Saturday
2/8/2014 12:00,2014-02-08,12:00,0,0.33,3.2,2,3,0,0,1,2014,2,12,Saturday
2/8/2014 13:00,2014-02-08,13:00,1,1,1.5,1,1,0,0,0,2014,2,13,Saturday
2/8/2014 14:00,2014-02-08,14:00,0,0,1,1.1,0,1,0,0,2014,2,14,Saturday
2/8/2014 15:00,2014-02-08,15:00,1,0,1,6,0,0,0,0,2014,2,15,Saturday
2/8/2014 16:00,2014-02-08,16:00,0,0,3,6,1,0,0,0,2014,2,16,Saturday
2/8/2014 17:00,2014-02-08,17:00,0,0.34,0.4,2,0,0,0,0,2014,2,17,Saturday
2/8/2014 18:00,2014-02-08,18:00,0,0.34,0,2,0,0,0,0,2014,2,18,Saturday
2/8/2014 19:00,2014-02-08,19:00,0,1.34,1,5,3,0,0,0,2014,2,19,Saturday
2/8/2014 20:00,2014-02-08,20:00,0,0,1.3,4,1,0,0,0,2014,2,20,Saturday
2/8/2014 21:00,2014-02-08,21:00,0,0,0,0,0,0,0,0,2014,2,21,Saturday
2/8/2014 22:00,2014-02-08,22:00,0,0,0,0,0,0,0,0,2014,2,22,Saturday
2/8/2014 23:00,2014-02-08,23:00,0,0,0,0,0,0,0,0,2014,2,23,Saturday
2/9/2014 0:00,2014-02-09,00:00,0,0,0,0,0,0,0,0,2014,2,0,Sunday
2/9/2014 1:00,2014-02-09,01:00,0,0,0,0,0,0,0,0,2014,2,1,Sunday
2/9/2014 2:00,2014-02-09,02:00,0,0,0,0,0,0,0,0,2014,2,2,Sunday
2/9/2014 3:00,2014-02-09,03:00,0,0,0,0,0,0,0,0,2014,2,3,Sunday
2/9/2014 4:00,2014-02-09,04:00,0,0,0,0,0,0,0,0,2014,2,4,Sunday
2/9/2014 5:00,2014-02-09,05:00,0,0,0,0,0,0,0,0,2014,2,5,Sunday
2/9/2014 6:00,2014-02-09,06:00,0,0,0,0,0,0,0,0,2014,2,6,Sunday
2/9/2014 7:00,2014-02-09,07:00,0,0,0,0,0,0,0,0,2014,2,7,Sunday
2/9/2014 8:00,2014-02-09,08:00,0,0,0,0,1,0,0,0,2014,2,8,Sunday
2/9/2014 9:00,2014-02-09,09:00,0,1,1,2.1,0,0,0,0,2014,2,9,Sunday
2/9/2014 10:00,2014-02-09,10:00,0,0,0,16.4,3,0,5,0,2014,2,10,Sunday
2/9/2014 11:00,2014-02-09,11:00,0,1,0,6,3,0,0,0,2014,2,11,Sunday
2/9/2014 12:00,2014-02-09,12:00,4,1,1,5,1,0,0,0,2014,2,12,Sunday
2/9/2014 13:00,2014-02-09,13:00,0,0,0,2,2,0,1,0,2014,2,13,Sunday
2/9/2014 14:00,2014-02-09,14:00,0,0,0,0,0,0,0,0,2014,2,14,Sunday
2/9/2014 15:00,2014-02-09,15:00,0,0,0,0,0,0,0,0,2014,2,15,Sunday
2/9/2014 16:00,2014-02-09,16:00,0,0,0,0,0,0,0,0,2014,2,16,Sunday
2/9/2014 17:00,2014-02-09,17:00,0,0,0,0,0,0,0,0,2014,2,17,Sunday
2/9/2014 18:00,2014-02-09,18:00,0,0,0,0,0,0,0,0,2014,2,18,Sunday
2/9/2014 19:00,2014-02-09,19:00,0,0,0,0,0,0,0,0,2014,2,19,Sunday
2/9/2014 20:00,2014-02-09,20:00,0,0,0,0,0,0,0,0,2014,2,20,Sunday
2/9/2014 21:00,2014-02-09,21:00,0,0,0,0,0,0,0,0,2014,2,21,Sunday
2/9/2014 22:00,2014-02-09,22:00,0,0,0,0,0,0,0,0,2014,2,22,Sunday
2/9/2014 23:00,2014-02-09,23:00,0,0,0,0,0,0,0,0,2014,2,23,Sunday
2/10/2014 0:00,2014-02-10,00:00,0,0,0,0,0,0,0,0,2014,2,0,Monday
2/10/2014 1:00,2014-02-10,01:00,0,0,0,0,0,0,0,0,2014,2,1,Monday
2/10/2014 2:00,2014-02-10,02:00,0,0,0,0,0,0,0,0,2014,2,2,Monday
2/10/2014 3:00,2014-02-10,03:00,0,0,0,0,0,0,0,0,2014,2,3,Monday
2/10/2014 4:00,2014-02-10,04:00,0,0,0,0,0,0,0,0,2014,2,4,Monday
2/10/2014 5:00,2014-02-10,05:00,0,0,0,0,0,0,0,0,2014,2,5,Monday
2/10/2014 6:00,2014-02-10,06:00,0,0,0,0,0,0,0,0,2014,2,6,Monday
2/10/2014 7:00,2014-02-10,07:00,0,0,0.5,0,0,0,0,0,2014,2,7,Monday
2/10/2014 8:00,2014-02-10,08:00,0,0,0,0,3,2,0,0,2014,2,8,Monday
2/10/2014 9:00,2014-02-10,09:00,0,1,0,0.1,0,0,0,0,2014,2,9,Monday
2/10/2014 10:00,2014-02-10,10:00,0,0,0,0,0,0,0,0,2014,2,10,Monday
2/10/2014 11:00,2014-02-10,11:00,0,2,1,0,0,0,0,0,2014,2,11,Monday
2/10/2014 12:00,2014-02-10,12:00,0,0,2,4,1,0,0,0,2014,2,12,Monday
2/10/2014 13:00,2014-02-10,13:00,0,0,0,7,4,0,0,0,2014,2,13,Monday
2/10/2014 14:00,2014-02-10,14:00,1,0,2,1,1,0,0,0,2014,2,14,Monday
2/10/2014 15:00,2014-02-10,15:00,2,1,0.6,8.2,1,0,0,0,2014,2,15,Monday
2/10/2014 16:00,2014-02-10,16:00,0,1,1,4,2,1,0,0,2014,2,16,Monday
2/10/2014 17:00,2014-02-10,17:00,1,1,0,3.3,1,0,3,0,2014,2,17,Monday
2/10/2014 18:00,2014-02-10,18:00,0,0.33,0,1,3,0,0,0,2014,2,18,Monday
2/10/2014 19:00,2014-02-10,19:00,1,1,0.4,6,2,0,0,1,2014,2,19,Monday
2/10/2014 20:00,2014-02-10,20:00,0,2,0,4.5,0,0,0,0,2014,2,20,Monday
2/10/2014 21:00,2014-02-10,21:00,0,1,1,1,2,0,0,0,2014,2,21,Monday
2/10/2014 22:00,2014-02-10,22:00,0,0,0,0,0,0,0,0,2014,2,22,Monday
2/10/2014 23:00,2014-02-10,23:00,0,0,0,0,0,0,0,0,2014,2,23,Monday
2/11/2014 0:00,2014-02-11,00:00,0,0,0,0,0,0,0,0,2014,2,0,Tuesday
2/11/2014 1:00,2014-02-11,01:00,0,0,0,0,0,0,0,0,2014,2,1,Tuesday
2/11/2014 2:00,2014-02-11,02:00,0,0,0,0,0,0,0,0,2014,2,2,Tuesday
2/11/2014 3:00,2014-02-11,03:00,0,0,0,0,0,0,0,0,2014,2,3,Tuesday
2/11/2014 4:00,2014-02-11,04:00,0,0,0,0,0,0,0,0,2014,2,4,Tuesday
2/11/2014 5:00,2014-02-11,05:00,0,0,0,0,0,0,0,0,2014,2,5,Tuesday
2/11/2014 6:00,2014-02-11,06:00,0,0,0,0,0,0,0,0,2014,2,6,Tuesday
2/11/2014 7:00,2014-02-11,07:00,0,0,0,0,0,0,0,0,2014,2,7,Tuesday
2/11/2014 8:00,2014-02-11,08:00,0,0,1,0,0,0,0,0,2014,2,8,Tuesday
2/11/2014 9:00,2014-02-11,09:00,0,0.33,0,0,0,0,0,0,2014,2,9,Tuesday
2/11/2014 10:00,2014-02-11,10:00,0,0,3,1,2,0,0,0,2014,2,10,Tuesday
2/11/2014 11:00,2014-02-11,11:00,0,1,1,8,2,0,1,0,2014,2,11,Tuesday
2/11/2014 12:00,2014-02-11,12:00,0,1.33,2,9,1,0,0,1,2014,2,12,Tuesday
2/11/2014 13:00,2014-02-11,13:00,1,0,1.3,1,3,2,0,0,2014,2,13,Tuesday
2/11/2014 14:00,2014-02-11,14:00,5,1,1,0,0,0,0,0.2,2014,2,14,Tuesday
2/11/2014 15:00,2014-02-11,15:00,0,2,1,2,0,0,0,0,2014,2,15,Tuesday
2/11/2014 16:00,2014-02-11,16:00,0,0,0,2.5,3,0,2,0,2014,2,16,Tuesday
2/11/2014 17:00,2014-02-11,17:00,2,0.33,0,11,1,0,0,0,2014,2,17,Tuesday
2/11/2014 18:00,2014-02-11,18:00,2,0,0,3,3,0,3,1,2014,2,18,Tuesday
2/11/2014 19:00,2014-02-11,19:00,0,0,2,3.6,2,0,0,0,2014,2,19,Tuesday
2/11/2014 20:00,2014-02-11,20:00,0,1,1,0,0,0,0,0,2014,2,20,Tuesday
2/11/2014 21:00,2014-02-11,21:00,0,0,0,3.5,3,0,0,0,2014,2,21,Tuesday
2/11/2014 22:00,2014-02-11,22:00,0,0,0,0,0,0,0,0,2014,2,22,Tuesday
2/11/2014 23:00,2014-02-11,23:00,0,0,0,0,0,0,0,0,2014,2,23,Tuesday
2/12/2014 0:00,2014-02-12,00:00,0,0,0,0,0,0,0,0,2014,2,0,Wednesday
2/12/2014 1:00,2014-02-12,01:00,0,0,0,0,0,0,0,0,2014,2,1,Wednesday
2/12/2014 2:00,2014-02-12,02:00,0,0,0,0,0,0,0,0,2014,2,2,Wednesday
2/12/2014 3:00,2014-02-12,03:00,0,0,0,0,0,0,0,0,2014,2,3,Wednesday
2/12/2014 4:00,2014-02-12,04:00,0,0,0,0,0,0,0,0,2014,2,4,Wednesday
2/12/2014 5:00,2014-02-12,05:00,0,0,0,0,0,0,0,0,2014,2,5,Wednesday
2/12/2014 6:00,2014-02-12,06:00,0,0,0,0,0,0,0,0,2014,2,6,Wednesday
2/12/2014 7:00,2014-02-12,07:00,0,0,0,1,0,0,0,0,2014,2,7,Wednesday
2/12/2014 8:00,2014-02-12,08:00,0,0,0,0,0,0,0,0,2014,2,8,Wednesday
2/12/2014 9:00,2014-02-12,09:00,0,0,0,2,2,0,0,0,2014,2,9,Wednesday
2/12/2014 10:00,2014-02-12,10:00,0,0.33,1,1,0,0,0,0,2014,2,10,Wednesday
2/12/2014 11:00,2014-02-12,11:00,1,0.34,0,8,0,0,0,0,2014,2,11,Wednesday
2/12/2014 12:00,2014-02-12,12:00,1,0,2,13,1,0,0,0,2014,2,12,Wednesday
2/12/2014 13:00,2014-02-12,13:00,0,0,4,8,0,0,0,0,2014,2,13,Wednesday
2/12/2014 14:00,2014-02-12,14:00,1,1,0,4,1,0,5,0,2014,2,14,Wednesday
2/12/2014 15:00,2014-02-12,15:00,1,0,1,8,0,0,0,0,2014,2,15,Wednesday
2/12/2014 16:00,2014-02-12,16:00,1,0,0,4,0,0,0,0,2014,2,16,Wednesday
2/12/2014 17:00,2014-02-12,17:00,0,0,0,0,0,0,0,0,2014,2,17,Wednesday
2/12/2014 18:00,2014-02-12,18:00,2,0,0.1,0,1,0,0,0,2014,2,18,Wednesday
2/12/2014 19:00,2014-02-12,19:00,1,0,0,15.1,0,0,0,0,2014,2,19,Wednesday
2/12/2014 20:00,2014-02-12,20:00,0,0,0,8,4,0,0,0,2014,2,20,Wednesday
2/12/2014 21:00,2014-02-12,21:00,1,0,1,1.5,0,0,0,0,2014,2,21,Wednesday
2/12/2014 22:00,2014-02-12,22:00,0,0,0,0,0,0,0,0,2014,2,22,Wednesday
2/12/2014 23:00,2014-02-12,23:00,0,0,0,0,0,0,0,0,2014,2,23,Wednesday
2/13/2014 0:00,2014-02-13,00:00,0,0,0,0,0,0,0,0,2014,2,0,Thursday
2/13/2014 1:00,2014-02-13,01:00,0,0,0,0,0,0,0,0,2014,2,1,Thursday
2/13/2014 2:00,2014-02-13,02:00,0,0,0,0,0,0,0,0,2014,2,2,Thursday
2/13/2014 3:00,2014-02-13,03:00,0,0,0,0,0,0,0,0,2014,2,3,Thursday
2/13/2014 4:00,2014-02-13,04:00,0,0,0,0,0,0,0,0,2014,2,4,Thursday
2/13/2014 5:00,2014-02-13,05:00,0,0,0,0,0,0,0,0,2014,2,5,Thursday
2/13/2014 6:00,2014-02-13,06:00,0,0,0,0,0,0,0,0,2014,2,6,Thursday
2/13/2014 7:00,2014-02-13,07:00,0,0,0,0,0,0,0,0,2014,2,7,Thursday
2/13/2014 8:00,2014-02-13,08:00,0,0,0,3.3,2,0,0,0,2014,2,8,Thursday
2/13/2014 9:00,2014-02-13,09:00,0,0,1,1,0,0,0,0,2014,2,9,Thursday
2/13/2014 10:00,2014-02-13,10:00,0,1,4,10,6,0,0,0,2014,2,10,Thursday
2/13/2014 11:00,2014-02-13,11:00,2,0,0,2,0,0,0,0,2014,2,11,Thursday
2/13/2014 12:00,2014-02-13,12:00,1,0,0,1,0,0,0,0,2014,2,12,Thursday
2/13/2014 13:00,2014-02-13,13:00,0,0.34,0,0.4,1,0,0,0,2014,2,13,Thursday
2/13/2014 14:00,2014-02-13,14:00,0,0,0,2,1,0,0,0,2014,2,14,Thursday
2/13/2014 15:00,2014-02-13,15:00,0.33,0,2,9,0,0,0,0,2014,2,15,Thursday
2/13/2014 16:00,2014-02-13,16:00,0,1,0,3.3,1,1,0,0,2014,2,16,Thursday
2/13/2014 17:00,2014-02-13,17:00,0,0,0,11,0,0,0,0,2014,2,17,Thursday
2/13/2014 18:00,2014-02-13,18:00,0,1.33,2,0,0,0,0,0,2014,2,18,Thursday
2/13/2014 19:00,2014-02-13,19:00,1,0,0,2,2,2,0,0,2014,2,19,Thursday
2/13/2014 20:00,2014-02-13,20:00,0,0,1,1,0,0,0,0,2014,2,20,Thursday
2/13/2014 21:00,2014-02-13,21:00,0,0,0,3.1,0,0,0,1,2014,2,21,Thursday
2/13/2014 22:00,2014-02-13,22:00,0,0,0,0,0,0,0,0,2014,2,22,Thursday
2/13/2014 23:00,2014-02-13,23:00,0,0,0,0,0,0,0,0,2014,2,23,Thursday
2/14/2014 0:00,2014-02-14,00:00,0,0,0,0,0,0,0,0,2014,2,0,Friday
2/14/2014 1:00,2014-02-14,01:00,0,0,0,0,0,0,0,0,2014,2,1,Friday
2/14/2014 2:00,2014-02-14,02:00,0,0,0,0,0,0,0,0,2014,2,2,Friday
2/14/2014 3:00,2014-02-14,03:00,0,0,0,0,0,0,0,0,2014,2,3,Friday
2/14/2014 4:00,2014-02-14,04:00,0,0,0,0,0,0,0,0,2014,2,4,Friday
2/14/2014 5:00,2014-02-14,05:00,0,0,0,0,0,0,0,0,2014,2,5,Friday
2/14/2014 6:00,2014-02-14,06:00,0,0,0,0,0,0,0,0,2014,2,6,Friday
2/14/2014 7:00,2014-02-14,07:00,0,1,0,0,0,0,0,0,2014,2,7,Friday
2/14/2014 8:00,2014-02-14,08:00,1,0,0,3,2,3,0,0,2014,2,8,Friday
2/14/2014 9:00,2014-02-14,09:00,1,0,0,0,0,0,0,1,2014,2,9,Friday
2/14/2014 10:00,2014-02-14,10:00,0,0,0,0,1,0,0,0,2014,2,10,Friday
2/14/2014 11:00,2014-02-14,11:00,0,0,0,2,1,0,0,0,2014,2,11,Friday
2/14/2014 12:00,2014-02-14,12:00,0,1,0,0,0,0,0,0,2014,2,12,Friday
2/14/2014 13:00,2014-02-14,13:00,0,0,0,7,6,0,0,0,2014,2,13,Friday
2/14/2014 14:00,2014-02-14,14:00,1,0,0,12.3,0,1,0,0,2014,2,14,Friday
2/14/2014 15:00,2014-02-14,15:00,0,0,0.2,1,0,0,0,0,2014,2,15,Friday
2/14/2014 16:00,2014-02-14,16:00,0,0,0,1,1,0,0,0,2014,2,16,Friday
2/14/2014 17:00,2014-02-14,17:00,0,0,1,0,1,0,0,0,2014,2,17,Friday
2/14/2014 18:00,2014-02-14,18:00,0,0,0,5,0,0,0,5,2014,2,18,Friday
2/14/2014 19:00,2014-02-14,19:00,1,0,1,6,1,0,0,0,2014,2,19,Friday
2/14/2014 20:00,2014-02-14,20:00,0,0.34,0,1,0,0,0,0,2014,2,20,Friday
2/14/2014 21:00,2014-02-14,21:00,0,1.67,1,4,0,0,0,0,2014,2,21,Friday
2/14/2014 22:00,2014-02-14,22:00,0,0,0,0,0,0,0,0,2014,2,22,Friday
2/14/2014 23:00,2014-02-14,23:00,0,0,0,0,0,0,0,0,2014,2,23,Friday
2/15/2014 0:00,2014-02-15,00:00,0,0,0,0,0,0,0,0,2014,2,0,Saturday
2/15/2014 1:00,2014-02-15,01:00,0,0,0,0,0,0,0,0,2014,2,1,Saturday
2/15/2014 2:00,2014-02-15,02:00,0,0,0,0,0,0,0,0,2014,2,2,Saturday
2/15/2014 3:00,2014-02-15,03:00,0,0,0,0,0,0,0,0,2014,2,3,Saturday
2/15/2014 4:00,2014-02-15,04:00,0,0,0,0,0,0,0,0,2014,2,4,Saturday
2/15/2014 5:00,2014-02-15,05:00,0,0,0,0,0,0,0,0,2014,2,5,Saturday
2/15/2014 6:00,2014-02-15,06:00,0,0,0,0,0,0,0,0,2014,2,6,Saturday
2/15/2014 7:00,2014-02-15,07:00,0,0,0,0,0,0,0,0,2014,2,7,Saturday
2/15/2014 8:00,2014-02-15,08:00,0,0,0,7,0,0,0,0,2014,2,8,Saturday
2/15/2014 9:00,2014-02-15,09:00,0,0,0,8,1,0,0,0,2014,2,9,Saturday
2/15/2014 10:00,2014-02-15,10:00,0,1,0,5,2,0,1,1,2014,2,10,Saturday
2/15/2014 11:00,2014-02-15,11:00,0,0,0,0,0,0,0,2,2014,2,11,Saturday
2/15/2014 12:00,2014-02-15,12:00,0,0.34,0,12,2,0,0,0,2014,2,12,Saturday
2/15/2014 13:00,2014-02-15,13:00,1,1,2,2,4,0,0,0,2014,2,13,Saturday
2/15/2014 14:00,2014-02-15,14:00,0,0,0,3,0,0,0,2,2014,2,14,Saturday
2/15/2014 15:00,2014-02-15,15:00,0,0,0,0,0,0,0,0,2014,2,15,Saturday
2/15/2014 16:00,2014-02-15,16:00,0,0,0,0,0,0,0,0,2014,2,16,Saturday
2/15/2014 17:00,2014-02-15,17:00,0,0,0,0,0,0,0,0,2014,2,17,Saturday
2/15/2014 18:00,2014-02-15,18:00,0,0,0,0,0,0,0,0,2014,2,18,Saturday
2/15/2014 19:00,2014-02-15,19:00,0,0,0,0,0,0,0,0,2014,2,19,Saturday
2/15/2014 20:00,2014-02-15,20:00,0,0,0,0,0,0,0,0,2014,2,20,Saturday
2/15/2014 21:00,2014-02-15,21:00,0,0,0,0,0,0,0,0,2014,2,21,Saturday
2/15/2014 22:00,2014-02-15,22:00,0,0,0,0,0,0,0,0,2014,2,22,Saturday
2/15/2014 23:00,2014-02-15,23:00,0,0,0,0,0,0,0,0,2014,2,23,Saturday
2/16/2014 0:00,2014-02-16,00:00,0,0,0,0,0,0,0,0,2014,2,0,Sunday
2/16/2014 1:00,2014-02-16,01:00,0,0,0,0,0,0,0,0,2014,2,1,Sunday
2/16/2014 2:00,2014-02-16,02:00,0,0,0,0,0,0,0,0,2014,2,2,Sunday
2/16/2014 3:00,2014-02-16,03:00,0,0,0,0,0,0,0,0,2014,2,3,Sunday
2/16/2014 4:00,2014-02-16,04:00,0,0,0,0,0,0,0,0,2014,2,4,Sunday
2/16/2014 5:00,2014-02-16,05:00,0,0,0,0,0,0,0,0,2014,2,5,Sunday
2/16/2014 6:00,2014-02-16,06:00,0,0,0,0,0,0,0,0,2014,2,6,Sunday
2/16/2014 7:00,2014-02-16,07:00,0,0,0,0,0,0,0,0,2014,2,7,Sunday
2/16/2014 8:00,2014-02-16,08:00,0,0.68,0,8,0,2,0,0,2014,2,8,Sunday
2/16/2014 9:00,2014-02-16,09:00,0,1,0,1,0,0,0,0,2014,2,9,Sunday
2/16/2014 10:00,2014-02-16,10:00,0,0,0,5,1,0,0,0,2014,2,10,Sunday
2/16/2014 11:00,2014-02-16,11:00,0,0,0.2,14,2,0,0,0,2014,2,11,Sunday
2/16/2014 12:00,2014-02-16,12:00,0,0,1,1,1,0,0,0,2014,2,12,Sunday
2/16/2014 13:00,2014-02-16,13:00,0,0,0,5,1,0,0,1,2014,2,13,Sunday
2/16/2014 14:00,2014-02-16,14:00,0,0,0,0,0,0,3,0,2014,2,14,Sunday
2/16/2014 15:00,2014-02-16,15:00,0,0,0,0,0,0,0,0,2014,2,15,Sunday
2/16/2014 16:00,2014-02-16,16:00,0,0,0,0,0,0,0,0,2014,2,16,Sunday
2/16/2014 17:00,2014-02-16,17:00,0,0,0,0,0,0,0,0,2014,2,17,Sunday
2/16/2014 18:00,2014-02-16,18:00,0,0,0,0,0,0,0,0,2014,2,18,Sunday
2/16/2014 19:00,2014-02-16,19:00,0,0,0,0,0,0,0,0,2014,2,19,Sunday
2/16/2014 20:00,2014-02-16,20:00,0,0,0,0,0,0,0,0,2014,2,20,Sunday
2/16/2014 21:00,2014-02-16,21:00,0,0,0,0,0,0,0,0,2014,2,21,Sunday
2/16/2014 22:00,2014-02-16,22:00,0,0,0,0,0,0,0,0,2014,2,22,Sunday
2/16/2014 23:00,2014-02-16,23:00,0,0,0,0,0,0,0,0,2014,2,23,Sunday
2/17/2014 0:00,2014-02-17,00:00,0,0,0,0,0,0,0,0,2014,2,0,Monday
2/17/2014 1:00,2014-02-17,01:00,0,0,0,0,0,0,0,0,2014,2,1,Monday
2/17/2014 2:00,2014-02-17,02:00,0,0,0,0,0,0,0,0,2014,2,2,Monday
2/17/2014 3:00,2014-02-17,03:00,0,0,0,0,0,0,0,0,2014,2,3,Monday
2/17/2014 4:00,2014-02-17,04:00,0,0,0,0,0,0,0,0,2014,2,4,Monday
2/17/2014 5:00,2014-02-17,05:00,0,0,0,0,0,0,0,0,2014,2,5,Monday
2/17/2014 6:00,2014-02-17,06:00,0,0,0,0,0,0,0,0,2014,2,6,Monday
2/17/2014 7:00,2014-02-17,07:00,0,0,2,0,0,0,0,0,2014,2,7,Monday
2/17/2014 8:00,2014-02-17,08:00,0,1,1,0,0,0,0,0,2014,2,8,Monday
2/17/2014 9:00,2014-02-17,09:00,1,0,0,2,0,0,0,0,2014,2,9,Monday
2/17/2014 10:00,2014-02-17,10:00,1.34,0,4,3,2,0,0,0,2014,2,10,Monday
2/17/2014 11:00,2014-02-17,11:00,2,0,0,6,0,0,0,0,2014,2,11,Monday
2/17/2014 12:00,2014-02-17,12:00,0,1,1,3,2,0,0,0,2014,2,12,Monday
2/17/2014 13:00,2014-02-17,13:00,0,0,1,0,2,1,5,0,2014,2,13,Monday
2/17/2014 14:00,2014-02-17,14:00,1,0,1.4,1,0,0,0,0,2014,2,14,Monday
2/17/2014 15:00,2014-02-17,15:00,0,1,1,2,3,0,0,0,2014,2,15,Monday
2/17/2014 16:00,2014-02-17,16:00,0,0,1,0,1,0,0,0,2014,2,16,Monday
2/17/2014 17:00,2014-02-17,17:00,2,1,0.3,1,0,0,2,0,2014,2,17,Monday
2/17/2014 18:00,2014-02-17,18:00,0,0,0,0,1,0,0,0,2014,2,18,Monday
2/17/2014 19:00,2014-02-17,19:00,0,0,0,3,2,0,0,0,2014,2,19,Monday
2/17/2014 20:00,2014-02-17,20:00,0,0,0,0,0,0,0,0,2014,2,20,Monday
2/17/2014 21:00,2014-02-17,21:00,0,0,0,6,0,0,0,0,2014,2,21,Monday
2/17/2014 22:00,2014-02-17,22:00,0,0,0,0,0,0,0,0,2014,2,22,Monday
2/17/2014 23:00,2014-02-17,23:00,0,0,0,0,0,0,0,0,2014,2,23,Monday
2/18/2014 0:00,2014-02-18,00:00,0,0,0,0,0,0,0,0,2014,2,0,Tuesday
2/18/2014 1:00,2014-02-18,01:00,0,0,0,0,0,0,0,0,2014,2,1,Tuesday
2/18/2014 2:00,2014-02-18,02:00,0,0,0,0,0,0,0,0,2014,2,2,Tuesday
2/18/2014 3:00,2014-02-18,03:00,0,0,0,0,0,0,0,0,2014,2,3,Tuesday
2/18/2014 4:00,2014-02-18,04:00,0,0,0,0,0,0,0,0,2014,2,4,Tuesday
2/18/2014 5:00,2014-02-18,05:00,0,0,0,0,0,0,0,0,2014,2,5,Tuesday
2/18/2014 6:00,2014-02-18,06:00,0,0,0,0,0,0,0,0,2014,2,6,Tuesday
2/18/2014 7:00,2014-02-18,07:00,0,0,0,8,0,0,0,0,2014,2,7,Tuesday
2/18/2014 8:00,2014-02-18,08:00,0,0,0,4,0,0,0,0,2014,2,8,Tuesday
2/18/2014 9:00,2014-02-18,09:00,0,0,0,0,1,0,0,0,2014,2,9,Tuesday
2/18/2014 10:00,2014-02-18,10:00,0,1.68,0,1,2,0,0,0,2014,2,10,Tuesday
2/18/2014 11:00,2014-02-18,11:00,0,0.34,0,2,0,0,1,1,2014,2,11,Tuesday
2/18/2014 12:00,2014-02-18,12:00,3,0,0,0,4,0,0,2,2014,2,12,Tuesday
2/18/2014 13:00,2014-02-18,13:00,0,0,0,1,0,0,0,0,2014,2,13,Tuesday
2/18/2014 14:00,2014-02-18,14:00,1,3,0,4,3,0,0,0,2014,2,14,Tuesday
2/18/2014 15:00,2014-02-18,15:00,1,0,0,5,1,0,0,0,2014,2,15,Tuesday
2/18/2014 16:00,2014-02-18,16:00,0.34,0,1,1,1,0,0,1,2014,2,16,Tuesday
2/18/2014 17:00,2014-02-18,17:00,1,0,3,4,0,0,0,1,2014,2,17,Tuesday
2/18/2014 18:00,2014-02-18,18:00,0,2,0,8,1,0,10,0,2014,2,18,Tuesday
2/18/2014 19:00,2014-02-18,19:00,0,0,1,0.6,0,0,2,0,2014,2,19,Tuesday
2/18/2014 20:00,2014-02-18,20:00,0,0.34,0.8,1,0,0,0,0,2014,2,20,Tuesday
2/18/2014 21:00,2014-02-18,21:00,1,0,0.3,5.4,1,0,0,0,2014,2,21,Tuesday
2/18/2014 22:00,2014-02-18,22:00,0,0,0,0,0,0,0,0,2014,2,22,Tuesday
2/18/2014 23:00,2014-02-18,23:00,0,0,0,0,0,0,0,0,2014,2,23,Tuesday
2/19/2014 0:00,2014-02-19,00:00,0,0,0,0,0,0,0,0,2014,2,0,Wednesday
2/19/2014 1:00,2014-02-19,01:00,0,0,0,0,0,0,0,0,2014,2,1,Wednesday
2/19/2014 2:00,2014-02-19,02:00,0,0,0,0,0,0,0,0,2014,2,2,Wednesday
2/19/2014 3:00,2014-02-19,03:00,0,0,0,0,0,0,0,0,2014,2,3,Wednesday
2/19/2014 4:00,2014-02-19,04:00,0,0,0,0,0,0,0,0,2014,2,4,Wednesday
2/19/2014 5:00,2014-02-19,05:00,0,0,0,0,0,0,0,0,2014,2,5,Wednesday
2/19/2014 6:00,2014-02-19,06:00,0,0,0,0,0,0,0,0,2014,2,6,Wednesday
2/19/2014 7:00,2014-02-19,07:00,0,0,0,0,0,0,0,0,2014,2,7,Wednesday
2/19/2014 8:00,2014-02-19,08:00,1,0,0,2,0,0,0,0,2014,2,8,Wednesday
2/19/2014 9:00,2014-02-19,09:00,0,0,1,0,2,0,1,0,2014,2,9,Wednesday
2/19/2014 10:00,2014-02-19,10:00,0,1,0,2,3,0,5,0,2014,2,10,Wednesday
2/19/2014 11:00,2014-02-19,11:00,0.33,2.34,0.5,6.4,1,0,0,0,2014,2,11,Wednesday
2/19/2014 12:00,2014-02-19,12:00,0,1,0,1,0,0,0,0,2014,2,12,Wednesday
2/19/2014 13:00,2014-02-19,13:00,0,0,0,0,1,0,0,0,2014,2,13,Wednesday
2/19/2014 14:00,2014-02-19,14:00,2,0,1,5.4,2,0,0,1,2014,2,14,Wednesday
2/19/2014 15:00,2014-02-19,15:00,0,0,1,10,2,1,0,0,2014,2,15,Wednesday
2/19/2014 16:00,2014-02-19,16:00,0,0,1,2,1,0,0,0,2014,2,16,Wednesday
2/19/2014 17:00,2014-02-19,17:00,0,0,0,4,1,0,0,0,2014,2,17,Wednesday
2/19/2014 18:00,2014-02-19,18:00,0,0,0,0,1,0,0,0,2014,2,18,Wednesday
2/19/2014 19:00,2014-02-19,19:00,0,0,1,11,2,0,0,0,2014,2,19,Wednesday
2/19/2014 20:00,2014-02-19,20:00,0,0.68,0,16,1,0,0,0,2014,2,20,Wednesday
2/19/2014 21:00,2014-02-19,21:00,0,0,0,7,0,0,0,0,2014,2,21,Wednesday
2/19/2014 22:00,2014-02-19,22:00,0,0,0,0,0,0,0,0,2014,2,22,Wednesday
2/19/2014 23:00,2014-02-19,23:00,0,0,0,0,0,0,0,0,2014,2,23,Wednesday
2/20/2014 0:00,2014-02-20,00:00,0,0,0,0,0,0,0,0,2014,2,0,Thursday
2/20/2014 1:00,2014-02-20,01:00,0,0,0,0,0,0,0,0,2014,2,1,Thursday
2/20/2014 2:00,2014-02-20,02:00,0,0,0,0,0,0,0,0,2014,2,2,Thursday
2/20/2014 3:00,2014-02-20,03:00,0,0,0,0,0,0,0,0,2014,2,3,Thursday
2/20/2014 4:00,2014-02-20,04:00,0,0,0,0,0,0,0,0,2014,2,4,Thursday
2/20/2014 5:00,2014-02-20,05:00,0,0,0,0,0,0,0,0,2014,2,5,Thursday
2/20/2014 6:00,2014-02-20,06:00,0,0,0,0,0,0,0,0,2014,2,6,Thursday
2/20/2014 7:00,2014-02-20,07:00,0,0,0,0,0,0,0,0,2014,2,7,Thursday
2/20/2014 8:00,2014-02-20,08:00,0,0,0,1,2,0,0,0,2014,2,8,Thursday
2/20/2014 9:00,2014-02-20,09:00,0,0,0,1,4,0,0,0,2014,2,9,Thursday
2/20/2014 10:00,2014-02-20,10:00,1,0,0,7,0,0,7,0,2014,2,10,Thursday
2/20/2014 11:00,2014-02-20,11:00,1,1,0,0,2,2,0,0,2014,2,11,Thursday
2/20/2014 12:00,2014-02-20,12:00,0,0,0,0,0,0,0,0,2014,2,12,Thursday
2/20/2014 13:00,2014-02-20,13:00,2,0,0,0,3,0,0,0,2014,2,13,Thursday
2/20/2014 14:00,2014-02-20,14:00,1,2,1,0,1,0,0,0,2014,2,14,Thursday
2/20/2014 15:00,2014-02-20,15:00,0,0,0,2,1,0,0,0,2014,2,15,Thursday
2/20/2014 16:00,2014-02-20,16:00,0,1,1,2,1,0,0,0,2014,2,16,Thursday
2/20/2014 17:00,2014-02-20,17:00,1,0,0,0,0,0,1,0,2014,2,17,Thursday
2/20/2014 18:00,2014-02-20,18:00,0,1,1,3,0,0,0,1,2014,2,18,Thursday
2/20/2014 19:00,2014-02-20,19:00,0,0.34,0.2,1,1,1,0,0,2014,2,19,Thursday
2/20/2014 20:00,2014-02-20,20:00,0,0.68,0,4,0,0,0,0,2014,2,20,Thursday
2/20/2014 21:00,2014-02-20,21:00,1,1,0,0.5,1,0,0,0,2014,2,21,Thursday
2/20/2014 22:00,2014-02-20,22:00,0,0,0,0,0,0,0,0,2014,2,22,Thursday
2/20/2014 23:00,2014-02-20,23:00,0,0,0,0,0,0,0,0,2014,2,23,Thursday
2/21/2014 0:00,2014-02-21,00:00,0,0,0,0,0,0,0,0,2014,2,0,Friday
2/21/2014 1:00,2014-02-21,01:00,0,0,0,0,0,0,0,0,2014,2,1,Friday
2/21/2014 2:00,2014-02-21,02:00,0,0,0,0,0,0,0,0,2014,2,2,Friday
2/21/2014 3:00,2014-02-21,03:00,0,0,0,0,0,0,0,0,2014,2,3,Friday
2/21/2014 4:00,2014-02-21,04:00,0,0,0,0,0,0,0,0,2014,2,4,Friday
2/21/2014 5:00,2014-02-21,05:00,0,0,0,0,0,0,0,0,2014,2,5,Friday
2/21/2014 6:00,2014-02-21,06:00,0,0,0,0,0,0,0,0,2014,2,6,Friday
2/21/2014 7:00,2014-02-21,07:00,0,0,0,1.4,0,0,0,0,2014,2,7,Friday
2/21/2014 8:00,2014-02-21,08:00,0,1,2,1,4,0,0,0,2014,2,8,Friday
2/21/2014 9:00,2014-02-21,09:00,2,0,0,0,1,0,0,0,2014,2,9,Friday
2/21/2014 10:00,2014-02-21,10:00,0,0,1,0,1,0,0,0,2014,2,10,Friday
2/21/2014 11:00,2014-02-21,11:00,1,0,1,2,0,0,0,0,2014,2,11,Friday
2/21/2014 12:00,2014-02-21,12:00,2,0,0,1,2,0,0,0,2014,2,12,Friday
2/21/2014 13:00,2014-02-21,13:00,0,0,0,0,3,0,0,0,2014,2,13,Friday
2/21/2014 14:00,2014-02-21,14:00,0,0,2,2,2,0,0,0,2014,2,14,Friday
2/21/2014 15:00,2014-02-21,15:00,0,1,0,0,0,0,0,0,2014,2,15,Friday
2/21/2014 16:00,2014-02-21,16:00,0,0,0,2,0,0,0,0,2014,2,16,Friday
2/21/2014 17:00,2014-02-21,17:00,0,0,0,5,0,0,0,0,2014,2,17,Friday
2/21/2014 18:00,2014-02-21,18:00,0,1.34,3,5,0,0,0,0,2014,2,18,Friday
2/21/2014 19:00,2014-02-21,19:00,0,0,0,0,3,0,0,0,2014,2,19,Friday
2/21/2014 20:00,2014-02-21,20:00,1,0,0,2,1,0,0,0,2014,2,20,Friday
2/21/2014 21:00,2014-02-21,21:00,0,1,0,4,0,0,0,0,2014,2,21,Friday
2/21/2014 22:00,2014-02-21,22:00,0,0,0,0,0,0,0,0,2014,2,22,Friday
2/21/2014 23:00,2014-02-21,23:00,0,0,0,0,0,0,0,0,2014,2,23,Friday
2/22/2014 0:00,2014-02-22,00:00,0,0,0,0,0,0,0,0,2014,2,0,Saturday
2/22/2014 1:00,2014-02-22,01:00,0,0,0,0,0,0,0,0,2014,2,1,Saturday
2/22/2014 2:00,2014-02-22,02:00,0,0,0,0,0,0,0,0,2014,2,2,Saturday
2/22/2014 3:00,2014-02-22,03:00,0,0,0,0,0,0,0,0,2014,2,3,Saturday
2/22/2014 4:00,2014-02-22,04:00,0,0,0,0,0,0,0,0,2014,2,4,Saturday
2/22/2014 5:00,2014-02-22,05:00,0,0,0,0,0,0,0,0,2014,2,5,Saturday
2/22/2014 6:00,2014-02-22,06:00,0,0,0,0,0,0,0,0,2014,2,6,Saturday
2/22/2014 7:00,2014-02-22,07:00,0,0,1,0,1,0,0,0,2014,2,7,Saturday
2/22/2014 8:00,2014-02-22,08:00,0,0,1,0,4,0,0,0,2014,2,8,Saturday
2/22/2014 9:00,2014-02-22,09:00,0,0,0,3,0,0,0,0,2014,2,9,Saturday
2/22/2014 10:00,2014-02-22,10:00,0,0,1,1,2,0,1,0,2014,2,10,Saturday
2/22/2014 11:00,2014-02-22,11:00,1,0.17,0.7,0,0,0,0,0,2014,2,11,Saturday
2/22/2014 12:00,2014-02-22,12:00,0,0,1,2,1,0,0,0,2014,2,12,Saturday
2/22/2014 13:00,2014-02-22,13:00,3,1,0,1,2,0,0,0,2014,2,13,Saturday
2/22/2014 14:00,2014-02-22,14:00,0,0,0,4,0,0,0,0,2014,2,14,Saturday
2/22/2014 15:00,2014-02-22,15:00,0,0,0,1,0,0,0,0,2014,2,15,Saturday
2/22/2014 16:00,2014-02-22,16:00,1,0,1,1,1,0,0,0,2014,2,16,Saturday
2/22/2014 17:00,2014-02-22,17:00,0,0,0,3,0,0,0,0,2014,2,17,Saturday
2/22/2014 18:00,2014-02-22,18:00,0,1,0,7,0,0,0,0,2014,2,18,Saturday
2/22/2014 19:00,2014-02-22,19:00,1,1,0,1,0,0,0,0,2014,2,19,Saturday
2/22/2014 20:00,2014-02-22,20:00,1,0,0,2,1,0,0,0,2014,2,20,Saturday
2/22/2014 21:00,2014-02-22,21:00,0,0,0,0,0,0,0,0,2014,2,21,Saturday
2/22/2014 22:00,2014-02-22,22:00,0,0,0,0,0,0,0,0,2014,2,22,Saturday
2/22/2014 23:00,2014-02-22,23:00,0,0,0,0,0,0,0,0,2014,2,23,Saturday
2/23/2014 0:00,2014-02-23,00:00,0,0,0,0,0,0,0,0,2014,2,0,Sunday
2/23/2014 1:00,2014-02-23,01:00,0,0,0,0,0,0,0,0,2014,2,1,Sunday
2/23/2014 2:00,2014-02-23,02:00,0,0,0,0,0,0,0,0,2014,2,2,Sunday
2/23/2014 3:00,2014-02-23,03:00,0,0,0,0,0,0,0,0,2014,2,3,Sunday
2/23/2014 4:00,2014-02-23,04:00,0,0,0,0,0,0,0,0,2014,2,4,Sunday
2/23/2014 5:00,2014-02-23,05:00,0,0,0,0,0,0,0,0,2014,2,5,Sunday
2/23/2014 6:00,2014-02-23,06:00,0,0,0,0,0,0,0,0,2014,2,6,Sunday
2/23/2014 7:00,2014-02-23,07:00,0,0,0,0,0,0,0,0,2014,2,7,Sunday
2/23/2014 8:00,2014-02-23,08:00,0,2,0,7,4,0,0,0,2014,2,8,Sunday
2/23/2014 9:00,2014-02-23,09:00,0,0,0,1,1,0,0,0,2014,2,9,Sunday
2/23/2014 10:00,2014-02-23,10:00,0,0,0,1,4,0,0,0,2014,2,10,Sunday
2/23/2014 11:00,2014-02-23,11:00,0,0.34,2,1,0,0,0,0,2014,2,11,Sunday
2/23/2014 12:00,2014-02-23,12:00,0,1,0,5,1,0,0,0,2014,2,12,Sunday
2/23/2014 13:00,2014-02-23,13:00,1,0,0,6,0,0,0,0,2014,2,13,Sunday
2/23/2014 14:00,2014-02-23,14:00,0,0,0,0,0,0,0,0,2014,2,14,Sunday
2/23/2014 15:00,2014-02-23,15:00,0,0,0,0,0,0,0,0,2014,2,15,Sunday
2/23/2014 16:00,2014-02-23,16:00,0,0,0,0,0,0,0,0,2014,2,16,Sunday
2/23/2014 17:00,2014-02-23,17:00,0,0,0,0,0,0,0,0,2014,2,17,Sunday
2/23/2014 18:00,2014-02-23,18:00,0,0,0,0,0,0,0,0,2014,2,18,Sunday
2/23/2014 19:00,2014-02-23,19:00,0,0,0,0,0,0,0,0,2014,2,19,Sunday
2/23/2014 20:00,2014-02-23,20:00,0,0,0,0,0,0,0,0,2014,2,20,Sunday
2/23/2014 21:00,2014-02-23,21:00,0,0,0,0,0,0,0,0,2014,2,21,Sunday
2/23/2014 22:00,2014-02-23,22:00,0,0,0,0,0,0,0,0,2014,2,22,Sunday
2/23/2014 23:00,2014-02-23,23:00,0,0,0,0,0,0,0,0,2014,2,23,Sunday
2/24/2014 0:00,2014-02-24,00:00,0,0,0,0,0,0,0,0,2014,2,0,Monday
2/24/2014 1:00,2014-02-24,01:00,0,0,0,0,0,0,0,0,2014,2,1,Monday
2/24/2014 2:00,2014-02-24,02:00,0,0,0,0,0,0,0,0,2014,2,2,Monday
2/24/2014 3:00,2014-02-24,03:00,0,0,0,0,0,0,0,0,2014,2,3,Monday
2/24/2014 4:00,2014-02-24,04:00,0,0,0,0,0,0,0,0,2014,2,4,Monday
2/24/2014 5:00,2014-02-24,05:00,0,0,0,0,0,0,0,0,2014,2,5,Monday
2/24/2014 6:00,2014-02-24,06:00,0,0,0,0,0,0,0,0,2014,2,6,Monday
2/24/2014 7:00,2014-02-24,07:00,0,0,0,0,0,0,0,0,2014,2,7,Monday
2/24/2014 8:00,2014-02-24,08:00,0,0,0,1,0,0,0,0,2014,2,8,Monday
2/24/2014 9:00,2014-02-24,09:00,1,0,0,4.4,1,0,0,1,2014,2,9,Monday
2/24/2014 10:00,2014-02-24,10:00,0,0,0,0,0,0,0,1,2014,2,10,Monday
2/24/2014 11:00,2014-02-24,11:00,1,1,1,2,0,0,0,1,2014,2,11,Monday
2/24/2014 12:00,2014-02-24,12:00,0,0,1,1,0,0,0,0,2014,2,12,Monday
2/24/2014 13:00,2014-02-24,13:00,0,1,1.2,2,2,0,0,0,2014,2,13,Monday
2/24/2014 14:00,2014-02-24,14:00,1,1,0,1,0,0,0,0,2014,2,14,Monday
2/24/2014 15:00,2014-02-24,15:00,2,1,0,1,1,0,0,0,2014,2,15,Monday
2/24/2014 16:00,2014-02-24,16:00,0,0,0,3,0,0,0,0,2014,2,16,Monday
2/24/2014 17:00,2014-02-24,17:00,0,0.34,0.2,1,0,0,0,0,2014,2,17,Monday
2/24/2014 18:00,2014-02-24,18:00,1,0,0,4,0,0,0,0,2014,2,18,Monday
2/24/2014 19:00,2014-02-24,19:00,1,0,1,1,0,0,0,0,2014,2,19,Monday
2/24/2014 20:00,2014-02-24,20:00,0,0.34,1,3.1,0,0,0,0,2014,2,20,Monday
2/24/2014 21:00,2014-02-24,21:00,0,0,0.1,2,0,0,0,0,2014,2,21,Monday
2/24/2014 22:00,2014-02-24,22:00,0,0,0,0,0,0,0,0,2014,2,22,Monday
2/24/2014 23:00,2014-02-24,23:00,0,0,0,0,0,0,0,0,2014,2,23,Monday
2/25/2014 0:00,2014-02-25,00:00,0,0,0,0,0,0,0,0,2014,2,0,Tuesday
2/25/2014 1:00,2014-02-25,01:00,0,0,0,0,0,0,0,0,2014,2,1,Tuesday
2/25/2014 2:00,2014-02-25,02:00,0,0,0,0,0,0,0,0,2014,2,2,Tuesday
2/25/2014 3:00,2014-02-25,03:00,0,0,0,0,0,0,0,0,2014,2,3,Tuesday
2/25/2014 4:00,2014-02-25,04:00,0,0,0,0,0,0,0,0,2014,2,4,Tuesday
2/25/2014 5:00,2014-02-25,05:00,0,0,0,0,0,0,0,0,2014,2,5,Tuesday
2/25/2014 6:00,2014-02-25,06:00,0,0,0,0,0,0,0,0,2014,2,6,Tuesday
2/25/2014 7:00,2014-02-25,07:00,0,0,0,0,0,0,0,0,2014,2,7,Tuesday
2/25/2014 8:00,2014-02-25,08:00,0,0,0,0,1,0,0,0,2014,2,8,Tuesday
2/25/2014 9:00,2014-02-25,09:00,0,0,1,1,5,0,0,0,2014,2,9,Tuesday
2/25/2014 10:00,2014-02-25,10:00,0,0,1,1,0,0,0,0,2014,2,10,Tuesday
2/25/2014 11:00,2014-02-25,11:00,1,0,2.2,1,1,0,0,0,2014,2,11,Tuesday
2/25/2014 12:00,2014-02-25,12:00,0,0,0,1,2,0,0,0,2014,2,12,Tuesday
2/25/2014 13:00,2014-02-25,13:00,0,0,1,0,0,0,0,0,2014,2,13,Tuesday
2/25/2014 14:00,2014-02-25,14:00,1,0,1,2,2,0,0,0,2014,2,14,Tuesday
2/25/2014 15:00,2014-02-25,15:00,1,0.34,0,1,0,0,0,0,2014,2,15,Tuesday
2/25/2014 16:00,2014-02-25,16:00,0,0,2,13.5,0,0,0,0,2014,2,16,Tuesday
2/25/2014 17:00,2014-02-25,17:00,1,1,1,2,0,0,0,0,2014,2,17,Tuesday
2/25/2014 18:00,2014-02-25,18:00,0,0,0,1,2,0,0,0,2014,2,18,Tuesday
2/25/2014 19:00,2014-02-25,19:00,0,0.34,0,5,0,0,0,1,2014,2,19,Tuesday
2/25/2014 20:00,2014-02-25,20:00,1,0,1,5,0,0,0,0,2014,2,20,Tuesday
2/25/2014 21:00,2014-02-25,21:00,0,0,1,1,0,0,0,1,2014,2,21,Tuesday
2/25/2014 22:00,2014-02-25,22:00,0,0,0,0,0,0,0,0,2014,2,22,Tuesday
2/25/2014 23:00,2014-02-25,23:00,0,0,0,0,0,0,0,0,2014,2,23,Tuesday
2/26/2014 0:00,2014-02-26,00:00,0,0,0,0,0,0,0,0,2014,2,0,Wednesday
2/26/2014 1:00,2014-02-26,01:00,0,0,0,0,0,0,0,0,2014,2,1,Wednesday
2/26/2014 2:00,2014-02-26,02:00,0,0,0,0,0,0,0,0,2014,2,2,Wednesday
2/26/2014 3:00,2014-02-26,03:00,0,0,0,0,0,0,0,0,2014,2,3,Wednesday
2/26/2014 4:00,2014-02-26,04:00,0,0,0,0,0,0,0,0,2014,2,4,Wednesday
2/26/2014 5:00,2014-02-26,05:00,0,0,0,0,0,0,0,0,2014,2,5,Wednesday
2/26/2014 6:00,2014-02-26,06:00,0,0,0,0,0,0,0,0,2014,2,6,Wednesday
2/26/2014 7:00,2014-02-26,07:00,0,0,0,0,0,0,0,0,2014,2,7,Wednesday
2/26/2014 8:00,2014-02-26,08:00,0,0,0,3,0,0,0,0,2014,2,8,Wednesday
2/26/2014 9:00,2014-02-26,09:00,0,0,0,0,1,0,0,0,2014,2,9,Wednesday
2/26/2014 10:00,2014-02-26,10:00,1,0.67,0,0,0,0,0,0,2014,2,10,Wednesday
2/26/2014 11:00,2014-02-26,11:00,0,0,0,1,1,0,0,0,2014,2,11,Wednesday
2/26/2014 12:00,2014-02-26,12:00,0,0,1,2,2,0,0,0,2014,2,12,Wednesday
2/26/2014 13:00,2014-02-26,13:00,0,2.34,0,0,1,0,0,0,2014,2,13,Wednesday
2/26/2014 14:00,2014-02-26,14:00,0,0,0,5,0,0,0,0,2014,2,14,Wednesday
2/26/2014 15:00,2014-02-26,15:00,1,0,0,5,0,0,0,0,2014,2,15,Wednesday
2/26/2014 16:00,2014-02-26,16:00,0,0,0,7,0,0,0,0,2014,2,16,Wednesday
2/26/2014 17:00,2014-02-26,17:00,0,0,0,2,0,0,0,0,2014,2,17,Wednesday
2/26/2014 18:00,2014-02-26,18:00,1,0,0,4,0,0,0,1,2014,2,18,Wednesday
2/26/2014 19:00,2014-02-26,19:00,0,0,0,2,0,0,2,0,2014,2,19,Wednesday
2/26/2014 20:00,2014-02-26,20:00,1,1,0,0,0,0,10,0,2014,2,20,Wednesday
2/26/2014 21:00,2014-02-26,21:00,1,0,0,3,0,0,0,0,2014,2,21,Wednesday
2/26/2014 22:00,2014-02-26,22:00,0,0,0,0,0,0,0,0,2014,2,22,Wednesday
2/26/2014 23:00,2014-02-26,23:00,0,0,0,0,0,0,0,0,2014,2,23,Wednesday
2/27/2014 0:00,2014-02-27,00:00,0,0,0,0,0,0,0,0,2014,2,0,Thursday
2/27/2014 1:00,2014-02-27,01:00,0,0,0,0,0,0,0,0,2014,2,1,Thursday
2/27/2014 2:00,2014-02-27,02:00,0,0,0,0,0,0,0,0,2014,2,2,Thursday
2/27/2014 3:00,2014-02-27,03:00,0,0,0,0,0,0,0,0,2014,2,3,Thursday
2/27/2014 4:00,2014-02-27,04:00,0,0,0,0,0,0,0,0,2014,2,4,Thursday
2/27/2014 5:00,2014-02-27,05:00,0,0,0,0,0,0,0,0,2014,2,5,Thursday
2/27/2014 6:00,2014-02-27,06:00,0,0,0,0,0,0,0,0,2014,2,6,Thursday
2/27/2014 7:00,2014-02-27,07:00,0,0,0,0,0,0,0,0,2014,2,7,Thursday
2/27/2014 8:00,2014-02-27,08:00,0,0,0,2,0,0,1,0,2014,2,8,Thursday
2/27/2014 9:00,2014-02-27,09:00,0,0,0,2,3,0,0,0,2014,2,9,Thursday
2/27/2014 10:00,2014-02-27,10:00,1,0,0,8,1,0,0,0,2014,2,10,Thursday
2/27/2014 11:00,2014-02-27,11:00,0,0.34,0,1,1,0,0,0,2014,2,11,Thursday
2/27/2014 12:00,2014-02-27,12:00,0,1,0,3,1,0,0,0,2014,2,12,Thursday
2/27/2014 13:00,2014-02-27,13:00,1,1,0,2,0,0,1,1,2014,2,13,Thursday
2/27/2014 14:00,2014-02-27,14:00,0,0,0,2,0,0,0,0,2014,2,14,Thursday
2/27/2014 15:00,2014-02-27,15:00,0,0,0,1.2,0,1,0,0,2014,2,15,Thursday
2/27/2014 16:00,2014-02-27,16:00,0,1,1,7,0,0,0,0,2014,2,16,Thursday
2/27/2014 17:00,2014-02-27,17:00,0,0,0,1,0,0,0,0,2014,2,17,Thursday
2/27/2014 18:00,2014-02-27,18:00,0,2,1,2,0,0,0,0,2014,2,18,Thursday
2/27/2014 19:00,2014-02-27,19:00,1,0,2,1,2,0,0,0,2014,2,19,Thursday
2/27/2014 20:00,2014-02-27,20:00,0,1,0,1,0,0,0,0,2014,2,20,Thursday
2/27/2014 21:00,2014-02-27,21:00,0,0,0,0,0,0,0,0,2014,2,21,Thursday
2/27/2014 22:00,2014-02-27,22:00,0,0,0,0,0,0,0,0,2014,2,22,Thursday
2/27/2014 23:00,2014-02-27,23:00,0,0,0,0,0,0,0,0,2014,2,23,Thursday
2/28/2014 0:00,2014-02-28,00:00,0,0,0,0,0,0,0,0,2014,2,0,Friday
2/28/2014 1:00,2014-02-28,01:00,0,0,0,0,0,0,0,0,2014,2,1,Friday
2/28/2014 2:00,2014-02-28,02:00,0,0,0,0,0,0,0,0,2014,2,2,Friday
2/28/2014 3:00,2014-02-28,03:00,0,0,0,0,0,0,0,0,2014,2,3,Friday
2/28/2014 4:00,2014-02-28,04:00,0,0,0,0,0,0,0,0,2014,2,4,Friday
2/28/2014 5:00,2014-02-28,05:00,0,0,0,0,0,0,0,0,2014,2,5,Friday
2/28/2014 6:00,2014-02-28,06:00,0,0,0,0,0,0,0,0,2014,2,6,Friday
2/28/2014 7:00,2014-02-28,07:00,0,0,0,0,0,0,0,0,2014,2,7,Friday
2/28/2014 8:00,2014-02-28,08:00,0,0,0,0,0,0,0,0,2014,2,8,Friday
2/28/2014 9:00,2014-02-28,09:00,0,0,0,0,0,0,0,0,2014,2,9,Friday
2/28/2014 10:00,2014-02-28,10:00,0,1,0,0.8,0,0,2,0,2014,2,10,Friday
2/28/2014 11:00,2014-02-28,11:00,0,0,0,0,0,0,0,0,2014,2,11,Friday
2/28/2014 12:00,2014-02-28,12:00,2,0,0,1,0,0,0,0,2014,2,12,Friday
2/28/2014 13:00,2014-02-28,13:00,0,0.68,1,2,1,0,0,0,2014,2,13,Friday
2/28/2014 14:00,2014-02-28,14:00,1,0.68,0.3,3,2,0,0,0,2014,2,14,Friday
2/28/2014 15:00,2014-02-28,15:00,2,2,0,7,2,1,0,0,2014,2,15,Friday
2/28/2014 16:00,2014-02-28,16:00,0,1,0,2,2,0,0,0,2014,2,16,Friday
2/28/2014 17:00,2014-02-28,17:00,0,0,0,3,0,0,0,0,2014,2,17,Friday
2/28/2014 18:00,2014-02-28,18:00,1,0,0,4,3,0,0,0,2014,2,18,Friday
2/28/2014 19:00,2014-02-28,19:00,1,2,1,3,2,0,0,0,2014,2,19,Friday
2/28/2014 20:00,2014-02-28,20:00,0,0,1.5,3.2,0,0,0,0,2014,2,20,Friday
2/28/2014 21:00,2014-02-28,21:00,0,0,1.5,8,0,0,0,0,2014,2,21,Friday
2/28/2014 22:00,2014-02-28,22:00,0,0,0,0,0,0,0,0,2014,2,22,Friday
2/28/2014 23:00,2014-02-28,23:00,0,0,0,0,0,0,0,0,2014,2,23,Friday
3/1/2014 0:00,2014-03-01,00:00,0,0,0,0,0,0,0,0,2014,3,0,Saturday
3/1/2014 1:00,2014-03-01,01:00,0,0,0,0,0,0,0,0,2014,3,1,Saturday
3/1/2014 2:00,2014-03-01,02:00,0,0,0,0,0,0,0,0,2014,3,2,Saturday
3/1/2014 3:00,2014-03-01,03:00,0,0,0,0,0,0,0,0,2014,3,3,Saturday
3/1/2014 4:00,2014-03-01,04:00,0,0,0,0,0,0,0,0,2014,3,4,Saturday
3/1/2014 5:00,2014-03-01,05:00,0,0,0,0,0,0,0,0,2014,3,5,Saturday
3/1/2014 6:00,2014-03-01,06:00,0,0,0,0,0,0,0,0,2014,3,6,Saturday
3/1/2014 7:00,2014-03-01,07:00,0,0,0,0,1,0,0,0,2014,3,7,Saturday
3/1/2014 8:00,2014-03-01,08:00,1,0,2,8,0,0,0,0.1,2014,3,8,Saturday
3/1/2014 9:00,2014-03-01,09:00,0,0,2,4,1,0,0,0,2014,3,9,Saturday
3/1/2014 10:00,2014-03-01,10:00,0,0,1.355,3,0,0,0,0,2014,3,10,Saturday
3/1/2014 11:00,2014-03-01,11:00,0.34,2,2,10.2,2,0,0,0,2014,3,11,Saturday
3/1/2014 12:00,2014-03-01,12:00,0,0,0,2,2,0,0,0,2014,3,12,Saturday
3/1/2014 13:00,2014-03-01,13:00,0,0,1,2,0,0,0,1,2014,3,13,Saturday
3/1/2014 14:00,2014-03-01,14:00,2,0,1,8,0,0,0,0,2014,3,14,Saturday
3/1/2014 15:00,2014-03-01,15:00,1,0,0,5,0,0,0,0,2014,3,15,Saturday
3/1/2014 16:00,2014-03-01,16:00,0,0,1,2,1,0,0,0,2014,3,16,Saturday
3/1/2014 17:00,2014-03-01,17:00,1,0.34,1,2,0,0,0,0,2014,3,17,Saturday
3/1/2014 18:00,2014-03-01,18:00,0,0,0,0.2,0,0,0,1,2014,3,18,Saturday
3/1/2014 19:00,2014-03-01,19:00,1,1,0,2.3,0,0,0,0,2014,3,19,Saturday
3/1/2014 20:00,2014-03-01,20:00,0,0.34,0,2,1,0,0,0,2014,3,20,Saturday
3/1/2014 21:00,2014-03-01,21:00,0,0,0,0,0,0,0,0,2014,3,21,Saturday
3/1/2014 22:00,2014-03-01,22:00,0,0,0,0,0,0,0,0,2014,3,22,Saturday
3/1/2014 23:00,2014-03-01,23:00,0,0,0,0,0,0,0,0,2014,3,23,Saturday
3/2/2014 0:00,2014-03-02,00:00,0,0,0,0,0,0,0,0,2014,3,0,Sunday
3/2/2014 1:00,2014-03-02,01:00,0,0,0,0,0,0,0,0,2014,3,1,Sunday
3/2/2014 2:00,2014-03-02,02:00,0,0,0,0,0,0,0,0,2014,3,2,Sunday
3/2/2014 3:00,2014-03-02,03:00,0,0,0,0,0,0,0,0,2014,3,3,Sunday
3/2/2014 4:00,2014-03-02,04:00,0,0,0,0,0,0,0,0,2014,3,4,Sunday
3/2/2014 5:00,2014-03-02,05:00,0,0,0,0,0,0,0,0,2014,3,5,Sunday
3/2/2014 6:00,2014-03-02,06:00,0,0,0,0,0,0,0,0,2014,3,6,Sunday
3/2/2014 7:00,2014-03-02,07:00,0,0,0,0,0,0,0,0,2014,3,7,Sunday
3/2/2014 8:00,2014-03-02,08:00,0,0,0,0,0,0,0,0,2014,3,8,Sunday
3/2/2014 9:00,2014-03-02,09:00,0,0,0,0,0,0,0,0,2014,3,9,Sunday
3/2/2014 10:00,2014-03-02,10:00,0,0,1,2,2,0,0,0,2014,3,10,Sunday
3/2/2014 11:00,2014-03-02,11:00,0.34,1,0,2.2,0,0,0,1,2014,3,11,Sunday
3/2/2014 12:00,2014-03-02,12:00,3,0,1,2.4,0,0,0,0,2014,3,12,Sunday
3/2/2014 13:00,2014-03-02,13:00,0,0,0,0,0,0,0,0,2014,3,13,Sunday
3/2/2014 14:00,2014-03-02,14:00,0,0,0,0,0,0,0,0,2014,3,14,Sunday
3/2/2014 15:00,2014-03-02,15:00,0,0,0,0,0,0,0,0,2014,3,15,Sunday
3/2/2014 16:00,2014-03-02,16:00,0,0,0,0,0,0,0,0,2014,3,16,Sunday
3/2/2014 17:00,2014-03-02,17:00,0,0,0,0,0,0,0,0,2014,3,17,Sunday
3/2/2014 18:00,2014-03-02,18:00,0,0,0,0,0,0,0,0,2014,3,18,Sunday
3/2/2014 19:00,2014-03-02,19:00,0,0,0,0,0,0,0,0,2014,3,19,Sunday
3/2/2014 20:00,2014-03-02,20:00,0,0,0,0,0,0,0,0,2014,3,20,Sunday
3/2/2014 21:00,2014-03-02,21:00,0,0,0,0,0,0,0,0,2014,3,21,Sunday
3/2/2014 22:00,2014-03-02,22:00,0,0,0,0,0,0,0,0,2014,3,22,Sunday
3/2/2014 23:00,2014-03-02,23:00,0,0,0,0,0,0,0,0,2014,3,23,Sunday
3/3/2014 0:00,2014-03-03,00:00,0,0,0,0,0,0,0,0,2014,3,0,Monday
3/3/2014 1:00,2014-03-03,01:00,0,0,0,0,0,0,0,0,2014,3,1,Monday
3/3/2014 2:00,2014-03-03,02:00,0,0,0,0,0,0,0,0,2014,3,2,Monday
3/3/2014 3:00,2014-03-03,03:00,0,0,0,0,0,0,0,0,2014,3,3,Monday
3/3/2014 4:00,2014-03-03,04:00,0,0,0,0,0,0,0,0,2014,3,4,Monday
3/3/2014 5:00,2014-03-03,05:00,0,0,0,0,0,0,0,0,2014,3,5,Monday
3/3/2014 6:00,2014-03-03,06:00,0,0,0,0,0,0,0,0,2014,3,6,Monday
3/3/2014 7:00,2014-03-03,07:00,0,0,0,0,0,0,0,0,2014,3,7,Monday
3/3/2014 8:00,2014-03-03,08:00,1,0,0,0,0,0,0,0,2014,3,8,Monday
3/3/2014 9:00,2014-03-03,09:00,0,0,0.2,1,1,0,0,0,2014,3,9,Monday
3/3/2014 10:00,2014-03-03,10:00,0,1,0,10,0,0,0,0,2014,3,10,Monday
3/3/2014 11:00,2014-03-03,11:00,0,0,0,1.4,0,2,0,0,2014,3,11,Monday
3/3/2014 12:00,2014-03-03,12:00,1,0,0,1,0,0,0,2,2014,3,12,Monday
3/3/2014 13:00,2014-03-03,13:00,1,0,0,0,0,0,0,0.2,2014,3,13,Monday
3/3/2014 14:00,2014-03-03,14:00,0,0,0,0,0,0,0,0,2014,3,14,Monday
3/3/2014 15:00,2014-03-03,15:00,0,0,0,0.4,0,0,0,0,2014,3,15,Monday
3/3/2014 16:00,2014-03-03,16:00,0,0,0,0,0,0,0,0,2014,3,16,Monday
3/3/2014 17:00,2014-03-03,17:00,0,0,0,2,0,0,0,0,2014,3,17,Monday
3/3/2014 18:00,2014-03-03,18:00,0,1.34,1.4,0,0,0,0,0,2014,3,18,Monday
3/3/2014 19:00,2014-03-03,19:00,1,1.34,0,3.2,0,0,0,0,2014,3,19,Monday
3/3/2014 20:00,2014-03-03,20:00,0,0,0,2,0,0,0,0,2014,3,20,Monday
3/3/2014 21:00,2014-03-03,21:00,0,0,0,1.1,0,0,0,0,2014,3,21,Monday
3/3/2014 22:00,2014-03-03,22:00,0,0,0,0,0,0,0,0,2014,3,22,Monday
3/3/2014 23:00,2014-03-03,23:00,0,0,0,0,0,0,0,0,2014,3,23,Monday
3/4/2014 0:00,2014-03-04,00:00,0,0,0,0,0,0,0,0,2014,3,0,Tuesday
3/4/2014 1:00,2014-03-04,01:00,0,0,0,0,0,0,0,0,2014,3,1,Tuesday
3/4/2014 2:00,2014-03-04,02:00,0,0,0,0,0,0,0,0,2014,3,2,Tuesday
3/4/2014 3:00,2014-03-04,03:00,0,0,0,0,0,0,0,0,2014,3,3,Tuesday
3/4/2014 4:00,2014-03-04,04:00,0,0,0,0,0,0,0,0,2014,3,4,Tuesday
3/4/2014 5:00,2014-03-04,05:00,0,0,0,0,0,0,0,0,2014,3,5,Tuesday
3/4/2014 6:00,2014-03-04,06:00,0,0,0,0,0,0,0,0,2014,3,6,Tuesday
3/4/2014 7:00,2014-03-04,07:00,0,0,0,0,0,0,0,0,2014,3,7,Tuesday
3/4/2014 8:00,2014-03-04,08:00,0,0,0,2,0,0,0,1,2014,3,8,Tuesday
3/4/2014 9:00,2014-03-04,09:00,0.34,0,0,15,0,0,0,0,2014,3,9,Tuesday
3/4/2014 10:00,2014-03-04,10:00,0,1,1,4.2,1,0,5,0,2014,3,10,Tuesday
3/4/2014 11:00,2014-03-04,11:00,0,1,0,5,0,0,0,0,2014,3,11,Tuesday
3/4/2014 12:00,2014-03-04,12:00,1,1,0,1.7,0,0,0,1,2014,3,12,Tuesday
3/4/2014 13:00,2014-03-04,13:00,1,0,1.2,0.375,1,0,0,0,2014,3,13,Tuesday
3/4/2014 14:00,2014-03-04,14:00,1,0.34,0,6,2,0,0,0,2014,3,14,Tuesday
3/4/2014 15:00,2014-03-04,15:00,1,1,2,0,2,0,0,1,2014,3,15,Tuesday
3/4/2014 16:00,2014-03-04,16:00,0,0,0,0,2,0,0,0,2014,3,16,Tuesday
3/4/2014 17:00,2014-03-04,17:00,0,0,0,2,0,0,0,0,2014,3,17,Tuesday
3/4/2014 18:00,2014-03-04,18:00,0,0,0,2,0,0,0,0,2014,3,18,Tuesday
3/4/2014 19:00,2014-03-04,19:00,1,1,1,0,0,0,0,0,2014,3,19,Tuesday
3/4/2014 20:00,2014-03-04,20:00,0,1.34,2,4,0,0,0,0,2014,3,20,Tuesday
3/4/2014 21:00,2014-03-04,21:00,0,0.34,0,5,1,0,0,1,2014,3,21,Tuesday
3/4/2014 22:00,2014-03-04,22:00,0,0,0,0,0,0,0,0,2014,3,22,Tuesday
3/4/2014 23:00,2014-03-04,23:00,0,0,0,0,0,0,0,0,2014,3,23,Tuesday
3/5/2014 0:00,2014-03-05,00:00,0,0,0,0,0,0,0,0,2014,3,0,Wednesday
3/5/2014 1:00,2014-03-05,01:00,0,0,0,0,0,0,0,0,2014,3,1,Wednesday
3/5/2014 2:00,2014-03-05,02:00,0,0,0,0,0,0,0,0,2014,3,2,Wednesday
3/5/2014 3:00,2014-03-05,03:00,0,0,0,0,0,0,0,0,2014,3,3,Wednesday
3/5/2014 4:00,2014-03-05,04:00,0,0,0,0,0,0,0,0,2014,3,4,Wednesday
3/5/2014 5:00,2014-03-05,05:00,0,0,0,0,0,0,0,0,2014,3,5,Wednesday
3/5/2014 6:00,2014-03-05,06:00,0,0,0,0,0,0,0,0,2014,3,6,Wednesday
3/5/2014 7:00,2014-03-05,07:00,0,0,0,0,0,0,0,0,2014,3,7,Wednesday
3/5/2014 8:00,2014-03-05,08:00,0,0,0,2,0,0,1,0,2014,3,8,Wednesday
3/5/2014 9:00,2014-03-05,09:00,0,0,0,2,0,0,0,0,2014,3,9,Wednesday
3/5/2014 10:00,2014-03-05,10:00,0,1,0,1,3,0,0,0,2014,3,10,Wednesday
3/5/2014 11:00,2014-03-05,11:00,1.34,0,1,9,0,0,0,0,2014,3,11,Wednesday
3/5/2014 12:00,2014-03-05,12:00,0,0,0,0,0,0,0,0,2014,3,12,Wednesday
3/5/2014 13:00,2014-03-05,13:00,0,0,0,0,0,0,0,0,2014,3,13,Wednesday
3/5/2014 14:00,2014-03-05,14:00,0,0,0,1,1,0,0,0,2014,3,14,Wednesday
3/5/2014 15:00,2014-03-05,15:00,0,0,0,0,0,0,0,0,2014,3,15,Wednesday
3/5/2014 16:00,2014-03-05,16:00,0,0,0,1,0,0,0,0,2014,3,16,Wednesday
3/5/2014 17:00,2014-03-05,17:00,1,0,0,1,0,0,0,0,2014,3,17,Wednesday
3/5/2014 18:00,2014-03-05,18:00,0,0,1,2,0,0,0,0,2014,3,18,Wednesday
3/5/2014 19:00,2014-03-05,19:00,0,0,1,4,0,0,0,0,2014,3,19,Wednesday
3/5/2014 20:00,2014-03-05,20:00,1,0,0,0,0,0,0,0,2014,3,20,Wednesday
3/5/2014 21:00,2014-03-05,21:00,0,0,0,2,0,0,0,0,2014,3,21,Wednesday
3/5/2014 22:00,2014-03-05,22:00,0,0,0,0,0,0,0,0,2014,3,22,Wednesday
3/5/2014 23:00,2014-03-05,23:00,0,0,0,0,0,0,0,0,2014,3,23,Wednesday
